Index,Topic,Content,Word_count,Key_words
21,rizzo foods sugar fruit juices vegan 5 pastries packaged disease,"She’s over the moon pie.

Jenna Rizzo, a weight loss coach from Georgia, is sharing the three types of groceries banned from her home — individually wrapped pastries, sodas and fruit juices and packaged vegan food.

“If you love these foods, go right ahead and eat them,” Rizzo advised her 83,000 TikTok followers in a video this month. “It’s just in my personal experience that these foods are just not generally conducive to overall health and weight loss goals, but it’s your life.”

5 Jenna Rizzo / TikTok

Individual pastries

5 Packaged pastries are ultra-processed foods, notorious for having lots of calories, sugar, fat and salt and little to no vitamins or fiber.

Rizzo placed Little Debbie Snacks, HoneyBuns and Pop-Tarts on her naughty list.

“These foods are on the banned list because we know they really don’t provide a lot of nutritional value for us — very high in saturated fat, very high in processed sugar,” Rizzo explained.

Packaged pastries are ultra-processed foods, notorious for having lots of calories, sugar, fat and salt and little to no vitamins or fiber.

Yet these disgraced foodstuffs are responsible for an astounding 60% of Americans’ daily caloric intake.

UPFs have been tied to 32 poor health outcomes, including a higher risk of cardiovascular disease, cancer, metabolic syndrome, obesity, non-alcoholic fatty liver disease, Type 2 diabetes and even premature death.

But that doesn’t mean Rizzo completely eschews sweets.

“I love sweets so much,” she shared. “If I want a pastry, I’m gonna go to my local bakery and get something that was made fresh and with love, not something that’s meant to be shelf-stable for 13 months.”

Sodas and fruit juices

5 “We know soda is not the healthiest thing,” Rizzo said. Getty Images

Sodas have long held a poor reputation for containing plenty of sugar and calories but no vitamins, minerals or fiber. Fruit juices, however, have earned a mixed reputation.

“I think we can all agree that we know soda is not the healthiest thing, but fruit juices typically surprise a lot of people,” Rizzo reasoned. “That’s because they’re thinking they’re drinking this good, healthy thing. In reality, most juices are just like a bunch of processed sugar made to taste like grapes or apples.”

Sugar-sweetened beverages — which include soft drinks, fruit drinks, sports drinks, energy drinks and sweetened water, coffee and tea refreshments — provide the most added sugar in the American adult diet, according to a 2023 study in the journal Nutrients.

5 “Most juices are just like a bunch of processed sugar made to taste like grapes or apples,” Rizzo said. Getty Images

Nearly seven in 10 adults have made SSBs part of their weekly diet, with 38% admitting they drink at least one or more a day.

SSB consumers run the risk of gaining weight, developing Type 2 diabetes and heart disease, experiencing tooth decay and impairing brain function.

Rizzo prefers making fruit juice at home so she can control the ingredients.

Get the latest breakthroughs in medicine, diet & nutrition tips and more. Subscribe to our weekly Post Care newsletter! Thanks for signing up! Enter your email address Please provide a valid email address. By clicking above you agree to the Terms of Use and Privacy Policy. Never miss a story. Check out more newsletters

Packaged vegan food

5 Beware ultra-processed vegan foods and grab high-quality natural foods instead, Rizzo advises. Getty Images

Rizzo’s beef is specifically with vegan UPFs — not all vegan foods.

“People see that label that it’s vegan and automatically think it’s going to be the healthier option,” Rizzo said. “Eating these fake meats and butters and cheeses that literally have an ingredient list longer than a CVS receipt did nothing more for my health.”

A recent study linked plant-based UPFs to a 7% higher risk of cardiovascular disease than unprocessed plant-sourced foods.

Rizzo finds it’s simply better to eat high-quality natural foods.",652,"im, vitamins, loss, buy, foods, sugar, juices, weight, disease, fruit, drinks, rizzo, coach, vegan"
22,cdc virus get vaccines dose updated americans covid immunocompromised second,"Less than half of Americans plan to get COVID or flu vaccines this year, survey finds

Immunocompromised people and those who are age 65 or older should get a second dose of the 2024-2025 COVID-19 vaccine, according to the latest recommendations from the Centers for Disease Control and Prevention.

In a statement released Wednesday, the CDC said the second dose should be received six months after the first dose.

The CDC also said its recommendations allow for flexibility for those who are moderately or severely immunocompromised to consider additional doses (three or more). in consultation with their health care provider.

In August, the Food and Drug Administration greenlit updated COVID-19 vaccines from Pfizer and Moderna for the 2024 fall season. The updated shots were revised to target the KP.2 variant of SARS-CoV-2, the virus that causes COVID-19, and medical experts say it will also provide protection against other recent strains.

This was part of a now-annual process undertaken by the FDA and health authorities around the world to update the vaccines to protect against newer strains of the virus.

Similar to previous seasons, the Centers for Disease Control and Prevention recommends that all Americans ages 6 months and older get a shot of the updated 2024-2025 COVID-19 vaccine to protect against another expected surge of the virus this fall and winter.

Still, as another fall virus season approaches, not everyone is following the CDC's advice. According to a survey from Ohio State Wexner Medical Center last month, less than half of Americans were planning to get their COVID or flu shots this season.

""Data continues to confirm the importance of vaccination to protect those most at risk for severe outcomes of COVID-19,"" the CDC noted in the latest release. ""Receiving recommended 2024-2025 COVID-19 vaccines can restore and enhance protection against the virus variants currently responsible for most infections and hospitalizations in the United States.""

The CDC also reminded the public that the COVID-19 vaccine can help reduce the chances of suffering the effects of long COVID.

Editor's note: This story has been updated to clarify that the second dose is recommended for everyone age 65 or over, as well as people who are immunocompromised.

contributed to this report.",368,"cdc, vaccines, age, updated, virus, dose, covid19, protect, vaccine, recommended, 65, covid, second, fall"
23,gut pneumoniae brain alzheimer infections may risk diseases research study,"Summary: Researchers have discovered that the gut bacteria Klebsiella pneumoniae can migrate to the brain, leading to inflammation and cognitive decline that mimic Alzheimer’s symptoms. The study suggests that hospital-acquired infections combined with disrupted gut microbiomes may increase the risk of developing neurodegenerative diseases.

Using a mouse model, scientists found that antibiotic exposure can cause microbiome imbalances, allowing K. pneumoniae to reach the brain. This study opens new avenues for preventing Alzheimer’s by managing infections and gut health.

Key Facts:

Klebsiella pneumoniae can migrate from the gut to the brain, triggering neuroinflammation.

Disrupted gut microbiomes after antibiotic use may contribute to Alzheimer’s risk.

The study emphasizes the role of hospital-acquired infections in neurodegenerative diseases.

Source: FSU

A groundbreaking study by researchers at Florida State University’s Gut Biome Lab has revealed a potential link between an infection caused by gut bacteria and the progression of Alzheimer’s disease.

The research found that the bacteria Klebsiella pneumoniae — a common bacteria notorious for causing hospital-acquired infections — can migrate from the gut into the bloodstream and eventually into the brain.

This bacterial invasion may lead to increased inflammation in the brain and impair cognitive functions, mimicking symptoms seen in Alzheimer’s patients.

The findings emphasize the potential risk hospital-acquired infections like K. pneumoniae may pose in the development of neurodegenerative diseases. Credit: Neuroscience News

The work was published in The Journal of Infectious Diseases.

“Hospitalizations and ICU stays, combined with antibiotic exposure, may lead to a further decline in microbiome diversity that leaves older adults at high risk not only for digestive issues but also for extra-intestinal pathologies such as neurodegenerative disorders through a dysregulation of the gut-brain axis,” said Ravinder Nagpal, an assistant professor in the FSU College of Education, Health, and Human Sciences and the director of the Gut Biome Lab.

The study is the first to show a direct correlation between K. pneumoniae infection and Alzheimer’s pathology, fueling the emerging field that investigates how infectious agents may trigger or aggravate Alzheimer’s disease.

It also paves the way for future research into how to treat harmful infectious agents in vulnerable populations such as the elderly or those recovering from sepsis.

The research suggests that when antibiotics disrupt the gut, it can lead to issues not just in the gut but also in the brain. Using a preclinical mouse model, researchers showed that antibiotic exposure depletes gut bacterial diversity and causes microbiome imbalance, which promotes the proliferation of K. pneumoniae by creating a favorable niche.

When this happens, K. pneumoniae can move from the gut into the bloodstream by passing through the gut lining and eventually reach the brain, triggering neuroinflammation and neurocognitive impairment.

The findings emphasize the potential risk hospital-acquired infections like K. pneumoniae may pose in the development of neurodegenerative diseases.

“Hospital-acquired and septic infections are one of the risk factors that may increase the predispositions to future neuroinflammatory and neurocognitive impairments, especially in older adults,” Nagpal said.

The study highlights the need for innovative therapeutic approaches to combat the rising prevalence of Alzheimer’s disease, in addition to existing amyloid and tau protein therapies. Further research could provide insight into preventive strategies aimed at managing hospital-acquired pathogens and preserving cognitive health in aging populations.

Funding: The research was funded by the Infectious Diseases Society of America and the Florida Department of Health.

The paper was co-authored by graduate researchers Ian Park, Saurabh Kadyan, and Nathaniel Hochuli from the FSU College of Education, Health, and Human Sciences. Additional collaborators included Hazel K. Stiebeling Professor Gloria Salazar; Associate Professor of psychology and neuroscience Aaron Wilber; University of Florida researchers Orlando Laitano, Paramita Chakrabarty, and Philip A. Efron; and Wake Forest University School of Medicine Associate Professor M. Ammar Zafar.

About this Alzheimer’s disease and microbiome research news

Author: Bill Wellock

Source: FSU

Contact: Bill Wellock – FSU

Image: The image is credited to Neuroscience News

Original Research: Open access.

“An Enteric Bacterial Infection Triggers Neuroinflammation and Neurobehavioral Impairment in 3xTg-AD Transgenic Mice” by Ravinder Nagpal et al. Journal of Infectious Diseases

Abstract

An Enteric Bacterial Infection Triggers Neuroinflammation and Neurobehavioral Impairment in 3xTg-AD Transgenic Mice

Background

Klebsiella pneumoniae is infamous for hospital-acquired infections and sepsis, which have also been linked to Alzheimer disease (AD)-related neuroinflammatory and neurodegenerative impairment. However, its causative and mechanistic role in AD pathology remains unstudied.

Methods

A preclinical model of K. pneumoniae enteric infection and colonization is developed in an AD model (3xTg-AD mice) to investigate whether and how K. pneumoniae pathogenesis exacerbates neuropathogenesis via the gut-blood-brain axis.

Results

K. pneumoniae, particularly under antibiotic-induced dysbiosis, was able to translocate from the gut to the bloodstream by penetrating the gut epithelial barrier. Subsequently, K. pneumoniae infiltrated the brain by breaching the blood-brain barrier. Significant neuroinflammatory phenotype was observed in mice with K. pneumoniae brain infection. K. pneumoniae-infected mice also exhibited impaired neurobehavioral function and elevated total tau levels in the brain.

Metagenomic analyses revealed an inverse correlation of K. pneumoniae with gut biome diversity and commensal bacteria, highlighting how antibiotic-induced dysbiosis triggers an enteroseptic “pathobiome” signature implicated in gut-brain perturbations.

Conclusions

The findings demonstrate how infectious agents following hospital-acquired infections and consequent antibiotic regimen may induce gut dysbiosis and pathobiome and increase the risk of sepsis, thereby increasing the predisposition to neuroinflammatory and neurobehavioral impairments via breaching the gut-blood-brain barrier.",880,"alzheimers, study, brain, research, risk, infections, k, progression, linked, gut, pneumoniae, hospitalacquired, bacteria"
