Index,Topic,Content,Word_count,Key_words
29,fireflies species firefly study fossil said mesozoic light new beetle,"Sign up for CNN’s Wonder Theory science newsletter. Explore the universe with news on fascinating discoveries, scientific advancements and more.

CNN —

When dinosaurs roamed Earth, their surroundings looked very different than the world of today. But there were also some similarities. And now scientists have confirmed a new one: Diverse firefly species lit up the night during the late Mesozoic.

The discovery comes from a fossil of an ancient firefly species that was initially discovered in 2016, trapped in 99 million-year-old Burmese amber from northern Myanmar. The beetle is only the second firefly species from the Mesozoic to be identified.

Scientists estimated that fireflies evolved aerial bioluminescence, the ability to glow during flight, at least 100 million years ago in a July 2022 study that analyzed the first Mesozoic firefly fossil that was described in 2015. But because firefly remains from this period can be difficult to come by since the insects’ softer bodies don’t preserve well in the fossil record, the evolution of the beetles and their bioluminescence has been difficult to pinpoint, experts say.

The recently identified species, dubbed Flammarionella hehaikuni, could help researchers better understand the early evolution of fireflies and this characteristic trait, according to a study published September 11 in the journal Proceedings of the Royal Society B: Biological Sciences.

“The fossil helps bridge gaps in understanding the evolutionary history of the lampyroid beetles (the beetle family fireflies belong to) and shows that key traits, like abdominal light organs, have remained consistent since the mid-Cretaceous,” said lead study author Chenyang Cai, professor at Nanjing Institute of Geology and Palaeontology at the Chinese Academy of Sciences in Beijing, in an email.

“How cool is it that dinosaurs once saw fireflies flying at dusk?”

The light organ located in the ancient species' abdomen is similar to ones seen in modern fireflies. Courtesy Professor Chenyang Cai

Fireflies in the land of dinosaurs

Upon first look of the firefly fossil in 2016, Cai said he thought the beetle was a type of click beetle in the Elateridae family — similar to a separate species Cai also helped to identify from Burmese amber in 2021 — due to the fossilized insect’s unique serrate antennae that modern fireflies do not have. But when he revisited the peculiar fossil described in the new study in late 2022, Cai noticed the well-preserved light organ, a characteristic of fireflies.

There are 10 past firefly species that are only known from fossils, said Dr. Oliver Keller, a research museum collection specialist at the University of Michigan in Ann Arbor who has studied the systematics and taxonomy of fireflies.

“The significance of this discovery is in the rarity of fossils of fireflies from that period,” Keller said via email. Because only one other Cretaceous firefly species has been identified, “this new species can be used to revisit the (July 2022 study) to better date the evolution of fireflies given the new evidence,” he added. Keller was not part of the new study or the 2022 research.

Fireflies glow for a multitude of reasons, most commonly as a defense mechanism and a way to communicate and attract mates. While it is hard to speculate how the flashes would have looked 100 million years ago, it is possible they would have looked similar to those seen today, Keller said.

The study authors named the beetle as a homage to French astronomer Camille Flammarion and Haikun He, an amateur collector who had donated several other amber specimens to the authors, according to the study.

Firefly diversity

There are more than 2,000 firefly species found today, according to the Natural History Museum in London. The study authors hypothesize that the newly reported ancient firefly species belonged to the Luciolinae, a subfamily that currently includes about 450 species, due to the placement of the light organ on the insect’s abdomen, said study coauthor Dr. Robin Kundrata, an entomologist and an associate professor in the department of zoology at the Palacký University Olomouc in the Czech Republic.

However, no existing Luciolinae species sports the peculiar antennae that the fossil had, which the authors suspect would also differ depending on the sex of the insect, according to the study. The newly identified fossil is that of a female.

What’s more, the firefly fossil, which measures less than 1 centimeter (0.4 inch) long, is morphologically different from the other specimen identified in 2015, showing that the light organs of Mesozoic species were more diverse than once thought but still similar to ones in modern fireflies, Kundrata said in an email.

The authors said they hope more firefly fossils from the Mesozoic will come to light to further scientists’ understanding of the mysterious origins of the bioluminescent beetles.

“Based on the recent knowledge, fireflies originated in the Mesozoic Era although the more precise period of their origin remains unclear. … Future discoveries may reveal further information on their diversity and morphology,” Kundrata said. “Since there is no information about the immature stages of fireflies from their early evolution, we would be happy for discoveries of fossil larval specimens from Mesozoic.”",846,"reveals, dinosaurs, study, authors, similar, light, species, mesozoic, previously, flickered, beetle, fireflies, undiscovered, firefly, fossil"
30,black palomar 5 holes cosmic cluster stellar stars hole globular,"10 Shares WhatsApp

Telegram

Facebook

LinkedIn

Twitter

Reddit

Pinterest



At the heart of this cosmic revelation lies Palomar 5, a stellar stream stretching across 30,000 light-years of space. Located approximately 80,000 light-years from Earth, this celestial wonder has captured the attention of scientists worldwide. Unlike typical globular clusters, Palomar 5 exhibits a unique characteristic : a long, sprawling river of stars that spans more than 20 degrees of the sky.

Researchers, led by astrophysicist Mark Gieles from the University of Barcelona, have meticulously studied Palomar 5 using advanced N-body simulations. These simulations recreate the orbits and evolutions of individual stars within the cluster, offering a glimpse into their cosmic journey. The results have been nothing short of astounding.

The team's findings suggest that Palomar 5 harbors an unexpected treasure trove : a swarm of over 100 stellar-mass black holes. This discovery challenges previous assumptions about the composition of globular clusters and opens up new avenues for understanding the formation of stellar streams.

Black holes : The architects of stellar streams

The presence of black holes within Palomar 5 appears to play a crucial role in shaping its unique structure. Gravitational interactions between stars and black holes act as cosmic slingshots, propelling stars out of the cluster and into the tidal stream. This process occurs more efficiently for stars than for black holes, gradually altering the cluster's composition.

Remarkably, the simulations revealed that black holes make up more than 20 percent of Palomar 5's total mass. This proportion is approximately three times higher than initially expected based on the cluster's stellar population. Each of these black holes boasts a mass of about 20 times that of our Sun, originating from supernova explosions during the cluster's early stages.

The implications of this discovery extend far beyond Palomar 5. Scientists now believe that other globular clusters may share a similar fate, eventually dissolving into stellar streams. This revelation provides valuable insights into the life cycle of these cosmic structures and their role in shaping our galaxy.

A cosmic Rosetta Stone

Palomar 5's unique characteristics make it an invaluable tool for understanding the formation and evolution of stellar streams. As Gieles explains, ""Palomar 5 is the only case, making it a Rosetta Stone for understanding stream formation."" This celestial oddity offers astronomers a rare opportunity to study the mechanisms behind these cosmic rivers in unprecedented detail.

The research team's simulations paint a fascinating picture of Palomar 5's future. In approximately one billion years, the cluster is predicted to dissolve completely. Just before this final act, the cluster's remnants will consist entirely of black holes, silently orbiting the galactic center.

This finding has significant implications for our understanding of black hole swarms detected in ancient star clusters in the Milky Way. It suggests that globular clusters may be prime locations for observing black hole collisions and searching for elusive intermediate-mass black holes.

Implications for future research

The discovery of this black hole swarm in Palomar 5 opens up exciting new avenues for astronomical research. Here are some key areas that scientists are eager to explore further :

The role of black holes in shaping galactic structures

The formation and evolution of stellar streams

The potential for detecting gravitational waves from black hole mergers

The search for intermediate-mass black holes

As our understanding of these cosmic phenomena grows, so too does our appreciation for the complexity and beauty of our universe. The Palomar 5 discovery serves as a testament to the power of advanced simulations and observational techniques in unraveling the mysteries of the cosmos.

Characteristic Palomar 5 Typical Globular Cluster Structure Loose, extended Dense, spherical Tidal Stream Present Absent Black Hole Proportion >20% of total mass ~7% of total mass

As we continue to explore the vast expanse of our Milky Way, discoveries like the black hole swarm in Palomar 5 remind us of the endless wonders that await our curious minds. The cosmic dance of stars and black holes paints a mesmerizing picture of our galactic home, inviting us to delve deeper into the mysteries of the universe.",674,"way, understanding, swarm, palomar, simulations, hole, stellar, milky, holes, scientists, black, galaxy, clusters, report, discovered, cosmic, stars, massive, moving"
31,space weather solar monitoring earth noaa storms sun cmes impacts,"13 Shares WhatsApp

Telegram

Facebook

LinkedIn

Twitter

Reddit

Pinterest



The National Oceanic and Atmospheric Administration (NOAA) has unveiled the first images from its Compact Coronagraph (CCOR-1), the world’s first operational space-based coronagraph.

Mounted on the newly launched GOES-19 satellite, CCOR-1 began its mission on September 19, 2024, providing continuous views of the sun's corona, the outermost layer of the solar atmosphere. This telescope is a major advancement in space weather monitoring, offering real-time data that will improve the prediction of coronal mass ejections (CMEs)—powerful solar storms that can have significant impacts on Earth.

CCOR-1: A Breakthrough in Solar Monitoring

NOAA's CCOR-1 represents a groundbreaking leap in the monitoring of solar activity. The telescope uses a technique called coronagraphy, where an occulting disk blocks the intense light from the sun’s surface, allowing it to capture images of the much fainter corona. This is where CMEs, massive bursts of plasma and magnetic fields, originate. These eruptions are of great interest to scientists because they can affect Earth’s magnetic field, causing geomagnetic storms that disrupt satellites, GPS systems, and even power grids.

The first images captured by CCOR-1 show a coronal mass ejection emerging from the sun’s surface. Describing the event, James Spann, chief scientist at NOAA's Office of Space Weather Observations, explained, “The smoky cloud coming off the left-hand side of the center in the image is a coronal mass ejection... an explosion on the surface of the sun that literally expels part of its atmosphere outwards.” These CMEs are composed of plasma, a superheated mixture of electrons and protons, and can travel at speeds of hundreds to thousands of miles per second.

One of the key innovations of CCOR-1 is its ability to provide images every 15 minutes, offering near real-time monitoring of the sun's activity. This high-frequency data stream represents a significant improvement over previous instruments, which often had long gaps between reports. As Spann noted, continuous observation is crucial for early warning of solar storms: “The aurora is kind of like the icing on the cake, the most visible manifestation of space weather, but there are other impacts that are not so obvious.” These impacts include communication disruptions, GPS interference, and risks to astronauts in space.

The Importance of Real-time Space Weather Forecasting

The real-time data provided by CCOR-1 will play a crucial role in improving space weather forecasting. Space weather refers to the conditions in space, particularly the behavior of solar winds and CMEs, that can affect Earth’s magnetosphere and ionosphere. When a CME is directed towards Earth, it can create geomagnetic storms that have wide-ranging consequences. For example, these storms can induce electrical currents in power lines, potentially damaging transformers and causing power outages. Additionally, satellites and communication networks can be disrupted, with significant implications for industries reliant on GPS, aviation, and maritime navigation.

By monitoring solar activity every 15 minutes, CCOR-1 ensures that NOAA can detect CMEs as they happen and predict their potential impacts on Earth. Spann emphasized that while auroras are the most visible effect of these storms, their unseen impacts can be far more dangerous: “Satellites and communication networks can be interrupted when a CME heads our way and can even pose a risk to astronauts on space stations.” Given the increasing reliance on satellite technologies, early detection of these solar storms is more important than ever.

A Future of Enhanced Solar Monitoring

NOAA’s deployment of CCOR-1 is just the beginning of an ambitious plan to enhance space weather forecasting. The GOES-19 satellite, currently undergoing post-launch testing, will assume its full operational role as the GOES East satellite in 2025, providing continuous coverage of solar activity from its position in geostationary orbit. CCOR-1’s data will be integrated into NOAA’s Space Weather Prediction Center, where scientists will use it to forecast space weather events and issue warnings to protect critical infrastructure on Earth.

NOAA also plans to expand its solar monitoring capabilities with additional coronagraphs, as part of its Space Weather Follow-On and Space Weather Next programs. These initiatives will place similar instruments both along the sun-Earth line and in orbit around the sun, creating a comprehensive network of solar observatories that can track CMEs from multiple angles. By doing so, NOAA aims to provide even more accurate and timely forecasts, ensuring that space weather’s impacts on Earth are minimized.

Spann highlighted the significance of these advancements, noting that previous coronagraphs sometimes left gaps of several hours in their coverage. CCOR-1 and its future counterparts will close these gaps, enabling scientists to monitor the sun's activity continuously and improve their understanding of how space weather events unfold.

The Critical Role of Space Weather Monitoring

As space-based technologies continue to advance and space exploration becomes more frequent, the need for accurate space weather forecasting has never been more pressing. Solar storms, particularly CMEs, pose serious risks not only to satellites but also to power grids and communication infrastructure on Earth. With increasing reliance on GPS navigation, satellite communications, and other technologies, the potential damage from a major geomagnetic storm could be catastrophic.

NOAA’s deployment of CCOR-1 represents a critical step forward in protecting Earth from these risks. By providing continuous, real-time monitoring of the sun’s activity, this new instrument will allow scientists to issue early warnings and help mitigate the impacts of solar storms before they reach Earth. The ongoing development of additional coronagraphs will further strengthen these efforts, ensuring that space weather monitoring remains at the forefront of global preparedness.",906,"monitoring, cmes, space, groundbreaking, weather, views, ccor1, impacts, telescope, earth, suns, delivers, solar, jawdropping, storms"
32,radio frb astronomers detected pulse bursts 20190203 fast dispersion burst,"This article has been reviewed according to Science X's editorial process and policies . Editors have highlighted the following attributes while ensuring the content's credibility:

An artist's impression of a fast radio burst (FRB) reaching Earth, with colors signifying different wavelengths. Credit: Jingchuan Yu, Beijing Planetarium.

Searching for pulsars using the Large Phased Array (LPA) radio telescope, Russian astronomers have detected a bright pulse at a frequency of 111 MHz, which appears to be a fast radio burst event. The finding was reported in a research paper published October 17 on the pre-print server arXiv.

Fast radio bursts (FRBs) are intense bursts of radio emission lasting milliseconds showcasing the characteristic dispersion sweep of radio pulsars. The physical nature of these bursts is yet unknown, and astronomers consider a variety of explanations ranging from synchrotron maser emission from young magnetars in supernova remnants to cosmic string cusps.

In general, FRBs are individual pulses with widths from 0.08 to 26 milliseconds and their dispersion measures usually range from 109 to 2,600 pc/cm3. Among the instruments capable of detecting pulses with such properties is LPA—one of the most sensitive radio telescopes operating at meter wavelengths.

Recently, a team of astronomers led by Sergey Tyul'bashev of the Pushchino Radio Astronomy Observatory in Russia, have detected an interesting pulse that may be an FRB. The discovery was made as part of the Pushchino Multibeams Pulsar Search (PUMPS) project, during a technical assessment of the quality of observations carried out with LPA of the Lebedev Physical Institute (LPI).

The discovered pulse lasted 211 milliseconds, had a dispersion measure of approximately 134.4 pc/cm3 and a peak flux density at a level of 20 Jy. The large dispersion measure of the pulse suggests its extragalactic origin and corresponds to a luminosity distance of about 2.3 billion light years.

According to the paper, the obtained properties indicate that the observed pulse is one of the most powerful fast radio bursts and the astronomers designated it FRB 20190203. The astronomers note that so far, no repeated radio bursts from FRB 20190203 have been detected, nor any activity has been observed in the gamma-ray range.

If the nature of FRB 20190203 is confirmed, it will make it the first burst of extragalactic origin discovered in the PUMPS survey. It is also the second FRB detected at such a low frequency (111 MHz), and the first one among non-repeating FRBs.

When it comes to the origin of FRB 20190203, the authors of the study propose the synchrotron maser emission scenario.

""In our opinion, the observed properties of FRB 20190203 are best explained by the model of a synchrotron maser source excited by a magnetar,"" the researchers conclude.

More information: S. A. Tyul'bashev et al, Pushchino multibeam pulsar search—V. The bright FRB 20190203 detected at 111 MHz, arXiv (2024). DOI: 10.48550/arxiv.2410.13561 Journal information: arXiv

© 2024 Science X Network",476,"burst, discover, frb, synchrotron, fast, astronomers, bright, radio, dispersion, bursts, 20190203, detected, pulse, pushchino"
33,image via nascar weekend win race scheme going playoffs paint,"This week the NASCAR Playoffs continue at Homestead-Miami Speedway. Two more races to determine the Championship 4. With it being a race in South Beach, you know teams are breaking out their best paint schemes for the weekend.

The bright colors and lights of Miami are iconic. Whenever NASCAR comes to town, it is a party. Since Pitbull joined the ownership group at Trackhouse Racing it has even taken on a new identity as a second home for the organization.

NASCAR at Homestead-Miami is almost always great. We have a triple-header weekend that will have fans entertained for hours. Here are the best designs you will see on the track Sunday.

Ross Chastain No. 1 Kubota Tractors Chevy

Image via NASCAR.com

This is a new take on a classic paint scheme. Look out, Ross Chastain has a great record in the Kubota colors and this time he has a personalized touch on his race tractor.

Chastain has already played spoiler once in these NASCAR Playoffs. Does he have another postseason win in him? 8/10.

Austin Cindric No. 2 Freightliner Ford

Image via NASCAR.com

While Austin Cindric is no longer in the playoffs, he has a great-looking Ford Mustang Dark Horse. It is Breast Cancer Awareness Month and Cindric is repping a pink variation of his Freightliner scheme.

This car is going to pop in the NASCAR Cup Series race at Homestead-Miami. Cindric could have another top-5 run or two up his sleeve. 7.5/10.

Josh Berry No. 4 Panini Prizm Ford

Image via NASCAR.com

This is one of the cooler sponsors this season for Josh Berry. These colors are perfect for Miami.

Berry is trailing Carson Hocevar in the Rookie of the Year race. He has a little bit of time to score a win in his first full-time season. 8/10.

Martin Truex Jr. No. 19 Bass Pro Shops Toyota

Image via NASCAR.com

How about a championship throwback? Martin Truex Jr. and Joe Gibbs Racing are bringing back this classic look for NASCAR weekend in Homestead-Miami.

Bass Pro Shops has had a lot of great schemes over the years. This one is going to live on forever in NASCAR history. 10/10.

Bubba Wallace No. 23 McDonald’s/RMHC Toyota

Image via NASCAR.com

McDonald’s and Ronald McDonald House Charities are joining up this weekend. Bubba Wallace will be easy to spot on the track.

With a bunch of little designs here and there over the car, this is a fun scheme. I wonder if the McDonald’s mascots will be out in full force for the weekend? 8.5/10.

Tyler Reddick No. 45 Beast Killer Sunrise Toyota

Image via NASCAR.com

This might be my favorite design of the entire weekend. The Beast Killer Sunrise paint scheme looks like Halloween and is going to be awesome on the track.

Tyler Reddick had a tough go of things last week in Vegas. He has one shot, more than likely, to get a win and make the Championship 4. 9.5/10.

Ricky Stenhouse Jr. No. 47 Kroger/Vitaminwater Chevy

Image via NASCAR.com

Purple and orange race car? Hell yeah! This is another unique and fun collaboration from Kroger. This time with Vitaminwater.

Ricky Stenhouse Jr. got a win at Talladega. He is hoping to finish the year strong and have a good showing in these final three weeks. 8.5/10

Daniel Suárez No. 99 FreewayFranchise.com Chevy

Image via NASCAR.com

No one wants to have a good weekend in Miami more than Daniel Suárez and this 99 team. A brand new paint scheme from Freeway and they are looking fresh for Sunday.

Suárez was knocked from the playoffs, but if he can get a win in his team owner’s hometown or help his teammate Ross Chastain get the win, he’s going to go for it. This blue is going to look great on track. 7.5/10.",632,"going, talk, win, race, weekend, great, nascar, schemes, paint, homesteadmiami, jr, playoffs, scheme, 400, week, straight, wireless"
