Input_Text,Accepted_Completion,Rejected_Completion
What month was the court ruling issued about Prince Harry's visa application privacy?,The ruling was issued a month before October 2024.,The ruling was issued in March 2024.
What is the title of Martha Stewart's new Netflix documentary released in 2024?,"The title is ""Martha.""","The title is ""Stewart: A Life."""
"Who directed the Netflix documentary ""Martha"" that Martha Stewart criticized in 2024?",The director is R.J. Cutler.,The director is Ava DuVernay.
Which part of Martha Stewart's life did she complain was overemphasized in her documentary?,Her 2004 Alderson Federal Prison Camp stint was overemphasized.,Her time as a television personality was overemphasized.
What specific type of music did Martha Stewart want in her documentary instead of a classical score?,She wanted rap music.,She wanted jazz music.
How did Martha Stewart view her incarceration according to her statements in 2024?,She considered it a vacation.,She considered it the most difficult period of her life.
"When was the ""Martha"" documentary released on Netflix?",It was released in 2024.,It was released in 2021.
Which district attorney expressed strong support for the Menendez brothers' bid for clemency in October 2024?,George Gascón.,Cyrus Vance Jr.
Who was the governor of California at the time the Menendez brothers sought clemency in 2024?,Gavin Newsom.,Arnold Schwarzenegger.
How many years have the Menendez brothers spent in custody as of 2024?,34 years.,28 years.
Which family member of Kittty Menendez did not support the brothers' clemency request?,Kitty Menendez’s brother.,Lyle Menendez's cousin.
Who was the attorney representing the Menendez brothers during their clemency bid in 2024?,Mark Geragos.,Alan Dershowitz.
What was the initial sentence given to the Menendez brothers after their conviction?,Life in prison without the possibility of parole.,Death penalty.
What action did George Gascón file regarding the Menendez brothers' sentencing?,A motion to resentence them from life without parole to life with parole.,A motion to reduce their sentence to 20 years.
"Under California law, why are the Menendez brothers eligible for immediate parole consideration?",They were 26 or younger at the time of their crimes.,They have served over 40 years in prison.
What date has been set for the Menendez brothers' resentencing request hearing?,"December 11, 2024.","January 15, 2025."
What did George Gascón emphasize about the Menendez brothers' behavior in prison?,Their dedication to rehabilitation and creation of support programs.,Their refusal to participate in rehabilitation programs.
How did Governor Gavin Newsom's office respond to inquiries about the Menendez brothers' clemency applications?,"They declined to comment, citing confidentiality.",They expressed public opposition to the clemency.
What did Gascón highlight as a reason for supporting clemency for the Menendez brothers?,Credible allegations of abuse by their father.,Financial hardships faced by the brothers in prison.
Which network reported on George Gascón's backing of the Menendez brothers' clemency bid?,CNN.,MSNBC.
What type of abuse did the Menendez brothers allege to have suffered from their father?,Sexual and physical abuse.,Financial exploitation.
Who announced the backing of the Menendez brothers' clemency request in 2024?,Los Angeles District Attorney George Gascón.,California Attorney General Rob Bonta.
Which Latin music superstar appeared onstage with Donald Trump in September 2024?,Nicky Jam.,Ricky Martin.
In which city did Nicky Jam withdraw his endorsement for Trump in October 2024?,Las Vegas.,Miami.
Which reggaeton star joined famous Puerto Ricans in condemning comments at Trump’s rally in October 2024?,Nicky Jam.,Luis Fonsi.
Which Vice President was receiving support from celebrities of Puerto Rican descent in October 2024?,Kamala Harris.,Mike Pence.
How many combined Instagram followers do the stars supporting Harris have as mentioned in October 2024?,390 million followers.,270 million followers.
Who is the reggaeton star that unexpectedly supported Harris in October 2024?,Bad Bunny.,Shakira.
"On what date was Beyoncé’s embrace with Kamala Harris captured, according to the article?","October 25, 2024.","October 18, 2024."
Which Hollywood star's early 2024 endorsement brought Gen Z attention to Harris' campaign?,Charli XCX.,Jennifer Lawrence.
"Which NFL quarterback joined Trump at a rally in Green Bay, Wisconsin, in October 2024?",Brett Favre.,Tom Brady.
Which social media platform did Bad Bunny use to share a video about Harris’ plans for Puerto Rico?,Instagram.,Twitter.
"On October 31, 2024, what time should one avoid shopping due to the Moon Alert in Chicago?",From 11:30 a.m. to 1 p.m.,From 12:00 p.m. to 2 p.m.
"Which astrological sign was experiencing a moon positioned opposite them on October 31, 2024?",Taurus.,Leo.
"Which ruling planet is mentioned dancing with Neptune on October 31, 2024, affecting Gemini?",Mercury.,Venus.
"What ruler of Aries is at odds with the moon on October 31, 2024?",Mars.,Saturn.
"On October 31, 2024, which astrological sign is advised to be cooperative and accommodating later in the day?",Taurus.,Aries.
"Which astrological event impacts Aries on the morning of October 31, 2024?",The moon is at odds with fiery Mars.,The moon conjoins with Venus.
"On October 31, 2024, which zodiac sign is cautioned to be patient with social outings and partners?",Gemini.,Scorpio.
During which song did Thom Yorke return to play after confronting the heckler?,Thom Yorke returned to play the Radiohead song Karma Police.,Thom Yorke returned to play the Radiohead song No Surprises.
On what date did Israel launch a campaign in response to an attack by Hamas in 2023?,The campaign was launched after the attack on 7 October 2023.,The campaign was launched after the attack on 15 September 2023.
How many people were taken hostage during the Hamas attack on southern Israel in 2023?,251 people were taken hostage during the Hamas attack.,367 people were taken hostage during the Hamas attack.
In what city did Thom Yorke confront a protester during his solo tour in Australia?,The confrontation occurred in Melbourne.,The confrontation occurred in Sydney.
For how many years has Radiohead played in Israel despite political controversies?,Radiohead has played in Israel for over 20 years.,Radiohead has played in Israel for over 15 years.
What was Thom Yorke's response to criticism about playing in Israel from pro-Palestinian activists?,Yorke stated that playing in a country isn't the same as endorsing its government.,Yorke stated that playing in a country is a form of political endorsement.
What did Yorke do with his guitar during the confrontation with the heckler?,Yorke removed his guitar and halted the set.,Yorke threw his guitar at the heckler.
What was Jonny Greenwood's stance on silencing Israeli artists?,Greenwood argued that silencing Israeli artists isn’t a way to reach understanding.,Greenwood supported the idea of silencing Israeli artists as a protest.
In what year did Thom Yorke defend Radiohead's performance in Tel Aviv amid boycott calls?,Yorke defended the performance in 2017.,Yorke defended the performance in 2022.
Who oversaw the Sidney Myer Music Bowl where Thom Yorke's concert disturbance occurred?,The Arts Centre Melbourne oversees the venue.,The Melbourne Concert Hall oversees the venue.
In what month and year did Joe Exotic announce his engagement to fellow inmate Jorge Marquez?,Joe Exotic announced his engagement in October 2024.,Joe Exotic announced his engagement in September 2024.
How long is Joe Exotic's federal prison sentence?,Joe Exotic is serving a 21-year federal prison sentence.,Joe Exotic is serving a 25-year federal prison sentence.
Where is Joe Exotic incarcerated?,"Joe Exotic is incarcerated at the Federal Medical Center in Fort Worth, Texas.","Joe Exotic is incarcerated at the Federal Medical Center in Atlanta, Georgia."
What crime was Joe Exotic convicted of that involves Carole Baskin?,Joe Exotic was convicted of scheming to hire a hitman to murder Carole Baskin.,Joe Exotic was convicted of robbery against Carole Baskin.
"In addition to scheming against Carole Baskin, what other violation was Joe Exotic convicted of?",Joe Exotic was also convicted of violating federal wildlife laws.,Joe Exotic was also convicted of tax evasion.
"What is the nationality of Joe Exotic's fiancée, Jorge Marquez?",Jorge Marquez is from Mexico.,Jorge Marquez is from Brazil.
In what month and year did Joe Exotic marry Dillon Passage?,Joe Exotic married Dillon Passage in December 2017.,Joe Exotic married Dillon Passage in January 2018.
"How many marriages has Joe Exotic had, including his engagement to Jorge Marquez?",This will be Joe Exotic's third marriage.,This will be Joe Exotic's fourth marriage.
What type of animal did Joe Exotic primarily look after at his G.W. Zoo?,Joe Exotic primarily looked after exotic big cats.,Joe Exotic primarily looked after marine animals.
How much money did Joe Exotic offer to hire a hitman according to federal prosecutors?,"Joe Exotic offered $10,000 to hire a hitman.","Joe Exotic offered $15,000 to hire a hitman."
What was Joe Exotic filming when he was arrested in 2018?,"Joe Exotic was filming the Netflix show ""Tiger King"" when he was arrested.","Joe Exotic was filming ""Survivor"" when he was arrested."
When was Joe Exotic’s sentence reduced by one year?,Joe Exotic’s sentence was reduced by one year in January 2022.,Joe Exotic’s sentence was reduced by one year in January 2021.
What age did Joe Exotic claim his fiancée Jorge Marquez is?,Joe Exotic claimed his fiancée Jorge Marquez is 33 years old.,Joe Exotic claimed his fiancée Jorge Marquez is 35 years old.
During what time period did Joe Exotic and Dillon Passage start the divorce process?,Joe Exotic and Dillon Passage filed for divorce in 2021.,Joe Exotic and Dillon Passage filed for divorce in 2020.
In what year did Joe Exotic gain worldwide fame from the Netflix docuseries?,Joe Exotic gained worldwide fame in 2020 from the Netflix docuseries.,Joe Exotic gained worldwide fame in 2019 from the Netflix docuseries.
How many husbands has Joe Exotic buried according to his statement?,Joe Exotic has buried two husbands.,Joe Exotic has buried three husbands.
What alias is Joe Exotic also known by?,Joe Exotic's real name is Joseph Maldonado-Passage.,Joe Exotic's real name is Joseph Malone-Savage.
On what date did senior Biden administration officials meet with Israel's leadership in an effort to secure a cease-fire in Lebanon?,"The meeting took place on Thursday, October 31, 2024.","The meeting took place on Wednesday, October 30, 2024."
"Where did William J. Burns, director of the CIA, meet with Egyptian President Abdel Fatah El-Sisi?",He met with El-Sisi in Cairo.,He met with El-Sisi in Tel Aviv.
What did the member of Hamas’s political bureau say about the cease-fire proposals they received?,The proposals were all rejected by Hamas.,The proposals were accepted by Hamas.
"What was Israel's stated priority, according to Prime Minister Benjamin Netanyahu, during the U.S. officials' visit?",Israel's priority was to thwart any threat to its security from Lebanon.,Israel's priority was to increase settlements in Lebanon.
Which country's President did CIA Director William J. Burns meet to discuss Gaza's situation?,He met with the President of Egypt.,He met with the President of Jordan.
What was set on fire in downtown Los Angeles following the Dodgers' World Series win?,A bus was set on fire.,A police car was set on fire.
Against which team did the Los Angeles Dodgers win the World Series in October 2024?,They won against the New York Yankees.,They won against the Boston Red Sox.
How many people were arrested in connection with the disturbances following the Dodgers' win?,A dozen people were arrested.,Two dozen people were arrested.
On which street did reports of stores being looted occur during the chaos in Los Angeles?,Looting was reported on Broadway and 8th Street.,Looting was reported on Melrose Avenue.
How many people were taken into custody on suspicion of commercial burglary?,Six people were taken into custody.,Ten people were taken into custody.
From which store were people shown looting on social media following the Dodgers' victory?,People were looting from a Nike store.,People were looting from a Macy's store.
How many World Series games did the Dodgers win to secure their victory against the Yankees?,They won four games to one.,They won four games to two.
Which city in California experienced lawlessness after the Dodgers' World Series win in 2024?,Los Angeles experienced lawlessness.,San Francisco experienced lawlessness.
"How many people in total were mentioned as involved in suspicious criminal activities, according to arrests?",Twelve people were involved in suspicious activities.,Twenty-four people were involved in suspicious activities.
"As of October 2024, who is a top election official in Arizona’s Maricopa County that faced threats for confirming the security of the 2020 election?",Stephen Richer.,Katie Hobbs.
Which Michigan state official publicly challenged Elon Musk's misinformation on social media in October 2024?,Michigan Secretary of State Jocelyn Benson.,Michigan Governor Gretchen Whitmer.
In what states did election officials express difficulty in combating misinformation from Elon Musk as of late October 2024?,"Pennsylvania, Michigan, and Arizona.","Ohio, Florida, and Georgia."
What did Elon Musk's America PAC use on X to report election irregularities in 2024?,An “Election Integrity Community” feed.,A “Voter Fraud Prevention Community” feed.
What legal maneuver did Elon Musk's lawyers file in Pennsylvania regarding his giveaway lawsuit in October 2024?,"A ""motion of removal"" to federal court.","A ""motion to dismiss"" in state court."
"When did Nick Pickles resign from his position, as mentioned regarding X's response to an election influence hearing?","September 6, 2024.","October 1, 2024."
What was the purpose of Michigan Secretary of State Jocelyn Benson gathering business and labor leaders in October 2024?,To brief them on how the state ensures every valid vote is tabulated.,To organize a fundraising event for election security.
What state does the article mention where election officials focus on regular press conferences rather than direct engagement with Musk?,Georgia.,Ohio.
"Who mentioned the importance of creating a ""paper trail"" for debunked claims to counter post-election challenges?",A Pennsylvania election official.,A Michigan election official.
During which month in 2024 did Senator Mark Warner express concern about social media platforms' preparedness for election misinformation?,September.,October.
What kind of giveaway is linked to Elon Musk's America PAC during the 2024 election season?,A daily $1 million sweepstakes for registered voters.,"A weekly $500,000 prize for Twitter users."
Which platform did CNN say was absent from a hearing on foreign election influence in 2024?,The X platform.,The Facebook platform.
Which Republican figure did Elena DiResta testify about at the hearings chaired by Jim Jordan?,Renée DiResta did not testify; Nina Jankowicz was mentioned in the article criticizing Musk.,Jocelyn Benson testified at the hearings.
"On October 30, 2024, who won the MVP award for the World Series?",Freddie Freeman won the World Series MVP.,Aaron Judge won the World Series MVP.
What was the final score of the decisive game in the 2024 World Series?,The final score was 7-6 in favor of the Dodgers.,The final score was 8-7 in favor of the Dodgers.
"On October 31, 2024, which city in New Mexico did Donald Trump visit as part of his campaign?","Donald Trump visited Albuquerque, New Mexico.","Donald Trump visited Santa Fe, New Mexico."
"How many years had it been since the GOP nominee for president was elected in the states Trump visited, as of 2024?",It had been two decades since a GOP nominee was elected there.,It had been three decades since a GOP nominee was elected there.
"As of the 2024 campaign trail, which political role does Kamala Harris hold?",Kamala Harris is the Vice President.,Kamala Harris is the Secretary of State.
"In 2024, trailed by more than 5 points, which states did Trump visit where he previously lost by double digits in 2020?",Trump visited New Mexico and Virginia.,Trump visited Florida and Ohio.
What significant event involving Shohei Ohtani is highlighted in the 2024 World Series coverage?,Shohei Ohtani won his first World Series with the Dodgers.,Shohei Ohtani was the losing pitcher in the final game.
"According to the article, how many inches of rain did some areas in Spain record during the 2024 flood disaster?",Some areas recorded nearly 8 inches of rain.,Some areas recorded nearly 3 inches of rain.
How many World Series titles have the Dodgers won in the last five years as of 2024?,The Dodgers have won two World Series titles.,The Dodgers have won three World Series titles.
In which U.S. state did Kamala Harris court young voters while Trump highlighted Biden's comments during a 2024 campaign event?,The event occurred in Wisconsin.,The event occurred in Michigan.
How many fatalities occurred in Spain due to the torrential rain in October 2024?,At least 95 people were killed.,At least 50 people were killed.
"Which scientist-involved facility is aiming to study neutrinos deep underground as reported on October 31, 2024?",The Underground Neutrino Observatory is studying neutrinos.,The Fermilab Neutrino Facility is studying neutrinos.
"During the 2024 presidential campaign, which battleground state did Harris and Trump both visit recently according to the article?",They both visited Wisconsin.,They both visited Georgia.
How did the Los Angeles Dodgers pull ahead for good in Game 5 of the 2024 World Series?,The Dodgers took the lead for good with two sacrifice flies in the eighth inning.,The Dodgers took the lead for good with a grand slam in the ninth inning.
Who was banned from Game 5 of the 2024 World Series for interference and had their tickets given to a cancer patient?,Two Yankees fans were banned.,Two Dodgers fans were banned.
"Where did former President Donald Trump hold a rally on October 31, 2024?","Henderson, Nevada.","Phoenix, Arizona."
"On October 31, 2024, where did Vice President Kamala Harris hold a rally encouraging Nevada voters?","Craig Ranch Amphitheater in Las Vegas, Nevada.","Albuquerque Convention Center in Albuquerque, New Mexico."
"As of October 31, 2024, what percentage of active voters had cast ballots in Georgia?",More than 50%.,Less than 30%.
"Who called on Latino voters to support Kamala Harris at a rally in Las Vegas on October 31, 2024?",Jennifer Lopez.,Shakira.
What new cabinet position did Trump announce he would create if re-elected in October 2024?,A position aimed at reducing the cost of living.,A position for international trade expansion.
Who endorsed Kamala Harris for president as a sports figure in October 2024?,LeBron James.,Tiger Woods.
"What was the significant turnout event noted in Georgia on October 31, 2024?",Over 3.7 million have already cast their ballots.,Only 1 million have already cast their ballots.
"Why was Stormy Daniels honored by witches in Salem on October 31, 2024?","She was given the ""Salem’s Witches’ Woman of Power Award.""","She was awarded the ""Salem's Sorceress of Justice Award."""
How many felony counts was Trump convicted of in the New York hush money trial involving Stormy Daniels?,34 felony counts.,22 felony counts.
"What city did Kamala Harris visit in Arizona on October 31, 2024, for her campaign?","Phoenix, Arizona.","Tucson, Arizona."
What role did Howard Lutnick claim Robert F. Kennedy Jr. would not obtain under Trump's administration?,Secretary of Health and Human Services.,Secretary of Commerce.
"Where did Trump make his claim to be the 'father of IVF' on October 31, 2024?","Henderson, Nevada.","El Paso, Texas."
"Which U.S. state court ruled on undated absentee ballots on October 31, 2024?",Pennsylvania state court.,New York state court.
"How long did Trump speak at a rally in Nevada on October 31, 2024?",More than 90 minutes.,Exactly 50 minutes.
Who hosted a concert for Harris' campaign in Milwaukee?,Cardi B.,Taylor Swift.
"What did Kamala Harris say about Trump’s vow to protect women ""whether the women like it or not""?","She found it ""very offensive to women.""","She described it as ""surprisingly considerate."""
"Who celebrated their victory in the World Series on October 31, 2024?",Los Angeles Dodgers.,New York Yankees.
"As of October 2024, how many North Korean troops were confirmed to be in or approaching the Kursk region?","About 3,000 North Korean troops.","About 1,000 North Korean troops."
Which US governmental body confirmed the presence of North Korean troops in the Kursk region in October 2024?,The United States Pentagon.,The Central Intelligence Agency.
What was the casualty figure reported for the Russian forces in the Kursk region over the past three months as of October 2024?,"Russia had suffered 17,800 casualties.","Russia had suffered 10,000 casualties."
How many North Korean troops had been sent for training in eastern Russia according to the October 2024 report?,"North Korea sent a total of 10,000 troops.","North Korea sent a total of 5,000 troops."
Who confirmed the deployment of North Korean troops to the Kursk region on a Monday in October 2024?,NATO Secretary-General Mark Rutte.,United Nations Secretary-General António Guterres.
"As of October 2024, what did Ukrainian ground forces commander Oleksandr Pavlyuk report in terms of Russian combat casualties in the past week?","An estimated 10,520 Russians were dead or wounded.","An estimated 5,200 Russians were dead or wounded."
How much of its drone contract had Ukraine fulfilled by October 2024?,Nearly 1.3 million drones had been delivered.,Nearly 2 million drones had been delivered.
"In October 2024, which high-ranking official specified that North Korea had sent troops to Russia's Kursk region?",Pentagon spokesman Pat Ryder.,Secretary of Defense Lloyd Austin.
Which South Korean news agency reported on Seoul's decision regarding military assistance to Ukraine in October 2024?,Yonhap News Agency.,The Korea Herald.
Who mentioned that North Korean troop deployment presents challenges such as desertion or defection in October 2024?,Olena Guseinova.,Pavlo Kyrylenko.
What did Olena Guseinova in her report in October 2024 suggest North Korea could potentially supply Russia with?,"3 to 4 units, comprising 15,000 to 20,000 soldiers.","10 to 12 units, comprising 30,000 to 40,000 soldiers."
"In October 2024, what did South Korea decide about sending 155mm shells to Ukraine?",Seoul decided not to send shells.,Seoul decided to send shells.
How did German defense contractor Rheinmetall enhance Ukraine's defense capabilities in 2024?,By building the first of four plants to produce Lynx armoured fighting vehicles.,By supplying 100 Leopard 2 tanks.
How many square kilometers per day was Russia advancing on average in September 2024?,14 square kilometres.,50 square kilometres.
How did the BRICS Kazan Declaration call for resolving the Ukraine conflict in 2024?,It emphasized a peaceful resolution consistent with the UN Charter.,It called for military intervention.
Which country hosted the BRICS summit in October 2024?,Russia in Kazan.,China in Beijing.
What was the focus of Ukraine's industrial policy according to President Zelenskyy in 2024?,Developing the domestic defense industry including drones and microchips.,Focusing solely on agricultural exports.
"What type of flu virus was detected in a pig in Oregon, marking the first instance of such an infection in the US?",H5N1 bird flu virus.,H1N1 swine flu virus.
In what type of farming operation was the H5N1 virus detected in a pig in Oregon?,A backyard farming operation.,A commercial farming operation.
When did officials announce the detection of H5N1 in an Oregon pig?,On a Wednesday.,On a Friday.
What other types of animals have tested positive for H5N1 in the US aside from pigs?,Poultry at the same farm.,Only domestic cats nearby.
"Which virus can pigs host in addition to the bird flu virus, raising concerns about genetic mixing?",Human flu viruses.,Rabies viruses.
What recent year did the H5N1 strain cause significant fatalities among birds and sea mammals?,Since 2020.,Since 2018.
"In what South American country were 40,000 sea lions and seals reportedly killed by H5N1?",Brazil.,Argentina.
What type of animals besides pigs recently showed unforeseen susceptibility to H5N1 in the US?,Cattle herds.,Domestic dogs.
"As of 2022, what was the fourth leading cause of death in the United States?",COVID-19 was the fourth leading cause of death.,Heart disease was the fourth leading cause of death.
Who is the co-senior author of the study conducted by the Cleveland Clinic about COVID-19 and cardiovascular risks?,Dr. Stanley Hazen is the co-senior author of the study.,Dr. Robert Martinez is the co-senior author of the study.
"According to Dr. Gerhard Albrecht, which blood types are more at risk for adverse cardiovascular events after contracting COVID-19?","Blood types A, B, and AB are more at risk.","Blood types O, A, and B are more at risk."
In what year did the COVID-19 virus first emerge?,The COVID-19 virus first emerged in 2019.,The COVID-19 virus first emerged in 2020.
What type of study data did Dr. Stanley Hazen mention in relation to COVID-19 and cardiac events?,Dr. Hazen mentioned studies showing an enhanced risk for cardiac events.,Dr. Hazen mentioned studies showing an enhanced risk for respiratory diseases.
