Index,Topic,Content,Word_count,Key_words
11,theatrical movies predator streaming movie one next idea alien great,"This was the summer that theatrical audiences really refamiliarized themselves with the famous 20th Century logo, arcing searchlights and all. The Disney-owned division was everywhere, thanks to hits Kingdom of the Planet of the Apes and Alien: Romulus, not to mention The First Omen. Even Deadpool & Wolverine, which grossed $1.3 billion, featured the logo before and in the movie, which was in part a love letter to the Fox era Marvel movies.

Guiding 20th is the steady hand of Steve Asbell, the longtime Fox exec who became president of the division in 2020, just when the pandemic hit. He navigated the transitional movies and then the pandemic movies, and then the switch to streaming and back to theatrical again.

But as much as the summer’s movies were about franchises long ago, the studio has one eye very much on the future. It is working with up-and-coming filmmakers on streaming features that it could pivot to theatrical if an opportunity opens up. And it’s stepping on the gas on some original theatrical movies.

“All of this success gives us equity and momentum to sort of take these shots,” says Asbell noting the division goes into production on a Bruce Springsteen feature starring Jeremy Allen White later this month and is due to shoot Send Help with Sam Raimi in January. Next year it will release a comedy from James L. Brookes and Rami Malek spy thriller The Amateur. More projects will get underway in the summer.

Even the offices are lively these days, with a life-size Planet Apes simian, adorned with cool shades, greeting visitors and a handsome wood-and-glass case being built to house the division’s many historical Oscars.

With Alien wrapping up its theatrical run in October and Springsteen close to starting production, Asbell, who oversees nine production executives along with their support teams, is catching his breath, if only for a moment. But he sat down with The Hollywood Reporter to discuss balancing streaming and theatrical, originals and established IP, and spilled more than he should about two, yes we said two, Predator movies coming next year.

This was in many ways the summer that 20th Century Studios came into its own within the Disney empire. So what does it mean being 20th Century Studios in 2024?

I’ve been here five years now almost, and it’s been an amazing journey with Disney in fact, because there is no sort of us and them, it’s just us. I mean, Alan [Bergman, Disney co-chair] has been a champion of ours since the beginning. He’s been supportive of our slate from the very beginning, all through marketing, distribution, publicity. We’re all very close now and we’re all friends. It feels very integrated and it feels like this summer, in particular, we were able to contribute to the larger Disney model. And now we have David Greenbaum, who’s, happily for me, a very old friend of mine. He’s an executive of impeccable taste and he’s brought a real energy, frankly, to both divisions. And so what it means is I think filmmakers, great franchises, and original films for both theatrical and streaming.

Where is the balance between originals and franchise plays?

Right now it’s looking like next year, half the slate. Job one was figuring out these franchise movies first and coming up with the right cadence of Avatar, Apes, Alien and Predator specifically. Getting those right was the first part, which we’ve done now. And so that idea is to be able to say, “Okay, we know when the Avatar movies are coming. We know now about Predator. There’ll be another Apes in ‘27, let’s just say.”So knowing where we can plan those franchises, it helps us look to see and ask what kinds of original movies in terms of genre do we want to test the marketplace with?

How do you decide which ones go streaming and which ones don’t?

The landscape has changed so that theatrical is back. There’s a lot more opportunity in theatrical films, but since the consolidation of Disney+ and Hulu, there’s a tremendous audience for those [streaming] films. There’s still that thing with the streaming movies where we can really take chances with it and they can sort of be what they need to be. They don’t necessarily have to hit that theatrical threshold of, “how much is it? How many screens?”

Alien: Romulus was supposed to go straight to streaming, but that changed right before filming. So what prompted that change?

It was started as a streaming movie because we started development when we were in COVID and it wasn’t clear what our strategy was going to be theatrical or streaming. At the time we had different sorts of budget categories for streaming, which we were always circumspect about not wanting to spend too much money on streaming movies. We didn’t know quite yet how they would perform based on the metrics. And the truth is we started it hoping that theatrical would return to some measure of normal. But we made that film and, frankly, every other film we’ve made for streaming, with the same care and curation as we do our theatrical movies.

What’s the next step for Alien?

We’re working on a sequel idea now. We haven’t quite closed our deal with Fede [Alvarez], but we are going to, and he has an idea that we’re working on. The two survivors, Rain and Andy, played by Cailee Spaeny and David Jonsson, were real highlights of the film. And so I always think of it like, “Wow, where do people want to see them go next?” We know there’s going to be aliens. We know there’s going to be great horror set pieces. But I fell in love with both of them and I want to see what their story is.

Jon Landau, who was producing the Avatar movies, sadly passed away this summer. Has the day-to-day on Avatar 3 changed at all?

It’s just hard personally, because Jon’s somebody I talked to every day and he was a mentor to me and a good friend and had unbelievable impact on everybody. I mean, it’s a huge loss. He was a great, great friend and a great sort of half mind to Jim [Cameron], however he describes it. We just miss him every day. But it hasn’t changed. It hasn’t affected the release date or Jim’s timeline or anything of that. We were already on a track that has its own milestones and guideposts.

Lightning round on 20th Century titles! Free Guy 2?

Not yet. [Shawn Levy and Ryan Reynolds] have to come up with an idea. And they’re just busy.

Kingsman sequels or prequels.

There’s no plans on doing them anytime soon.

More Agatha Christie mystery movies.

More, yes. We have, And Then There Were None. We have Witness for the Prosecution. We’re doing Miss Marple. There’s a bunch of other titles that we’re working on. We have very close relationship with the estate.

A Master and Commander prequel?

I’m trying so hard. It’s the first movie I worked on at Fox twenty years ago. We have a great script. It just needs the right director.

Any Die Hard plans?

No, not yet.

Here’s a big one. Will the next Predator movie get a theatrical release? [Editors note: this conversation took place before Disney dated Predator: Badlands for a 2025 release in theaters.]

Yes. And no.

You’re killing me here.

Yes, a Predator movie will have a theatrical. I’ll tell you very simply. After Prey became a success, Dan [Trachtenberg] came back and said he didn’t want to do Prey 2. And we’re like, “What do you want to do?” And he rattled off a bunch of ideas that were really crazy but really cool. We’ve actually done two of them. Two are coming out next year. One I can’t talk about yet, but the other one is the live-action Predator film with Elle Fanning that just wrapped in New Zealand. That’ll be out theatrically sometime next year.

You’re blowing my mind. Let’s tackle this one at time. One Predator movie is coming out theatrically?

It’s titled Badlands and it is an absolutely bonkers idea. It is a sci-fi thing, but it’s not what everybody thinks it is. And I mean, it’s awesome. It is so nuts. But in Dan, we trust.

Now you said there’s a second Predator movie.

There’s a second Predator movie that we have different plans for. Dan has actually directed both.

So there’s a secret Predator movie—

There’s a secret Predator movie that will come out before the theatrical one that I can’t say anything about yet.

Fine. Will we eventually see another Alien vs. Predator?

Probably.

Not sure how I feel about that.

It wouldn’t be in the way you think. That’s the thing. Not in the way that it will just be called Alien vs. Predator or anything like the original movies. If we do this, they’ll be organically created out of these two franchises that we’ve continued with characters that we fall in love with and those characters will combine…perhaps. But we haven’t gotten to that point. And we’re not just going to bang it out.

At a 30th anniversary screening of Speed a few weeks ago, Sandra Bullock said Hollywood may not be brave enough for a Speed 3. Response?

Hollywood is brave enough. We are brave enough. We are sitting by the phone. (Laughs)

It is one of those last movies that we haven’t remade. And to really be a reason to come back, it’s got to be a great idea and an idea that excites (Bullock and Keanu Reeves). Because that’d be the reason to see it. It’s obviously a really important title for us, but it’s not something we would handle lightly or just try to press them into service. They’d have to be a part of the development of that idea.

A version of this story first appeared in the Oct. 23 issue of The Hollywood Reporter magazine. To receive the magazine, click here to subscribe.",1678,"movie, streaming, idea, disney, century, theatrical, theres, great, steve, sequel, table, secret, really, speed, movies, predator, chat, studios"
12,new musical broadway production theatre show also tony design back,"Back to the Future: the Musical is leaving New York at 88 miles per hour. The Broadway production, which opened at the Winter Garden Theatre August 3, 2023, will play its final performance January 5, 2025, after playing more than 500 performances.

The closing makes the show the second musical to announce a closing date on ""Black Sunday,"" the first Sunday after New Year's that tends to kick off steep drop in tourism throughout New York City. Suffs will also close January 5.



Based on the 1985 Universal Pictures/Amblin Entertainment film about teenager Marty McFly—who is accidentally transported back to 1955 in a time-traveling DeLorean invented by Dr. Emmett Brown—the musical has a book by Bob Gale, and new music and lyrics by Alan Silvestri and Glen Ballard, with additional songs from the film, including “The Power of Love” and “Johnny B. Goode.”

As previously announced, a German staging of the musical will open in the 2025–2026 season, with details to be announced. The show is also headed to Royal Caribbean's new cruise ship Star of the Seas in a 100-minute condensed iteration. That staging will debut along with the ship when it disembarks from Port Canaveral in Orlando, Florida, in August 2025.

Said producer Colin Ingram, “With nearly 40 percent of our audience never having seen a production on Broadway before, I’m proud that at a time when theatre is viewed by so many as being inaccessible that this show was able to bring in a new audience, and it is my hope that this legacy endures and these people return to see another Broadway show in the future. We are having the same success across the North American tour where the show has already been seen by half a million people—many also new to the theatre. We look forward to welcoming fans to the theatre with four new productions opening next year including Japan and Germany as they join our two existing productions in London’s West End (now in its 4th year) and the North American tour.”



The Broadway cast currently features Tony winner and 2024 Tony nominee Roger Bart as Doc Brown, Casey Likes as Marty McFly, Liana Hunt as Lorraine Baines, Jelani Remy as Goldie Wilson/Marvin Berry, Evan Alexander Smith as George McFly, David Josefsberg as Strickland, and Nathaniel Hackmann as Biff Tannen.

Tony winner John Rando directs. The production also features set and costume design by Tim Hatley, lighting design by Tim Lutkin and Hugh Vanstone, sound design by Gareth Owen, video design by Finn Ross, choreography by Chris Bailey, musical supervision and arrangements by Nick Finlow, illusions by Chris Fisher, orchestrations by Ethan Popp and Bryan Crook, dance arrangements by David Chase, and casting by Tara Rubin. Bespoke Theatricals serves as general manager.



Back to the Future: The Musical made its world premiere at the Manchester Opera House in March 2020. The West End production opened in London September 13, 2021, at the Adelphi Theatre (where it continues) and subsequently won the Best New Musical Olivier Award. The Broadway production was nominated for two Tony awards, taking home none.



Visit BacktotheFutureMusical.com.",517,"sets, broadway, future, production, tony, final, design, west, musical, york, theatre, ride, winner"
13,longoria huffpost stahelski john wick support free million help us,"LOADING ERROR LOADING

“John Wick” fans might want to start thanking Eva Longoria.

The “Desperate Housewives” star quietly invested millions of dollars in the action franchise’s first movie, saving “John Wick” from potential oblivion, director Chad Stahelski said in a Business Insider interview published Monday.

“We were less than a week out and we lost almost $6 million on a gap financing,” Stahelski recalled amid the 10th anniversary of the film’s release. “We were financing independently to get the bond, but one of the investors couldn’t raise the money in time.”

Advertisement

He added, “[Longoria] came to the rescue and she provided the gap financing” less than 24 hours before a crucial deadline — though producer Basil Iwanyk hadn’t told him how this windfall arrived.

So Stahelski was blown away when he “found out by the end of the movie” that Longoria, known for her suburban escapades on ABC’s “Desperate Housewives,” was the one who’d stepped in to help.

“Basil took us out to dinner, and we were laughing about all the bullshit that happened, and he said: ‘By the way, funny story, you know who gap financed you? Eva Longoria,’” Stahelski told Business Insider, remembering his shock at the news.

Director Chad Stahelski recalled that actor Eva Longoria, pictured here, invested $6 million in ""John Wick."" Taylor Hill/FilmMagic/Getty Images

Advertisement

Centered on a retired assassin seeking vengeance on gangsters who killed his dog, the first “John Wick” film took in over $86 million worldwide against a $20 million budget, spawning a billion-dollar franchise known for its stunt work and choreographed fights while further establishing actor Keanu Reeves as an action hero.

But the movie marked just one of many Hollywood investments for Longoria, who founded the production company Unbelievable Entertainment in 2005 and has helped produce TV series like Lifetime’s “Devious Maids,” NBC’s “Telenovela” and ABC’s “Grand Hotel.”

Following the success of “John Wick,” Stahelski said, “We took her out to lunch at [Los Angeles hot spot] Chateau Marmont and she was laughing going, ‘I didn’t think it was going to work.’” But fortunately for Longoria, it did.

Support Free Journalism Consider supporting HuffPost starting at $2 to help us provide free, quality journalism that puts people first. Can't afford to contribute? Support HuffPost by creating a free account and log in while you read. Thank you for your past contribution to HuffPost. We are sincerely grateful for readers like you who help us ensure that we can keep our journalism free for everyone. The stakes are high this year, and our 2024 coverage could use continued support. Would you consider becoming a regular HuffPost contributor? Thank you for your past contribution to HuffPost. We are sincerely grateful for readers like you who help us ensure that we can keep our journalism free for everyone. The stakes are high this year, and our 2024 coverage could use continued support. We hope you'll consider contributing to HuffPost once more. Support HuffPost Already contributed? Log in to hide these messages.

David Leitch, an uncredited co-director on the film, told Business Insider that he’d “love to work with” Longoria on another project — and is already “trying to find something.”",528,"investment, director, actor, longoria, work, film, huffpost, million, john, support, alist, stahelski, free, wick, journalism, saved"
14,lopez combs noa jennifer sean 2000 diddy parties ojani relationship,"Sean 'Puffy' Combs with Jennifer Lopez in the audience at the 1st Annual Latin Grammy Awards broadcast on Wednesday, September 13, 2000 at the Staples Center in Los Angeles, CA.

Jennifer Lopez has been accused of attending and participating in Sean “Diddy” Combs’ now-infamous “freak-off” parties during their time as a couple.

Ojani Noa, J.Lo’s first husband, took to social media to distance himself from any connection to Combs’ “freak-off” parties, but gladly claimed that the singer and actress was one of multiple celebrities present at those affairs.

In a post on Instagram, Noa shared a list of stars who’ve allegedly attended Diddy’s parties, one being Lopez, whom Combs dated during the late ’90s and early ’00s.

Jennifer Lopez and Sean “Puffy” Combs arrive for the 2000 MTV Video Music Awards September 7, 2000 at Radio City Music Hall in New York City. On Valentine’s Day, February 14, 2001, Combs’ spokesperson announced that Lopez and Combs were no longer a couple. The announced confirmed months of speculation over demise of the superstars” relationship. George De Sota/Newsmakers

“I’M NOT ON THE LIST,” Noa captioned the post. “To those people and media outlets asking if I ever went or participated in that Piece of Sh*t (DIDDY’S) Freak-Off Parties. No and No. Never. But my Ex-Wife (Jennifer Lopez) a.k.a (JLO) Did.. Ask Her.”

Lopez’s disgruntled former lover continued, urging the public to question her regarding the alleged explicit recordings and other questionable items federal agents claim to have found during their investigation into Combs.

“Oh and ask her about the SEX TAPES,” he added. “The 734 Dildos And The BABY OIL.”

4/7/97 Los Angeles, CA Jennifer Lopez and husband Ojani Noa at the premiere of the new movie “Anaconda” Albert Ortega / Stringer

Noa has expressed his seeming disdain for both Lopez and Combs in recent weeks amid the latter’s federal indictment and arrest on racketeering and sex trafficking charges in September.

Ojani, who married Lopez in February 1997 before the couple divorced less than a year later, blames their split on Combs’ working relationship with Lopez.

That relationship, which was forged during the making of Lopez’s debut album, On the 6, later became romantic, with Diddy and Lopez dating between 1999 and 2001 before calling it quits.

Jennifer Lopez and Sean “Puffy” Combs at the 2000 Grammy Awards in Los Angeles. Scott Gries / Staff

“She went from Jen to being J Lo, this big business bringing in millions,” Noa once told Daily Mail of the shift in their relationship. “She had all these new people around her, all wanting to make money off her. I would call and an assistant would say, ‘Sorry, she’s not available.’”

See Ojani Noa’s Instagram post below. VIBE has reached out to Lopez’s rep for comment.",460,"los, parties, combs, lopezs, puffy, sean, freakoff, exhusband, claims, involved, noa, jennifer, post, 2000, relationship, lopez, diddys"
15,combs new 11 court celebrity victim diddy party claims seen,"New photo evidence submitted in court illustrates Sean “Diddy” Combs’ behavior at his booze-fueled parties where he allegedly assaulted men, women and minors.

New images show the embattled rapper dancing at a party at his suite at the Planet Hollywood Hotel while surrounded by young women and bottles of vodka, according to an action filed by Texas-based lawyer Tony Buzbee on Sunday and obtained by Page Six.

An alleged victim has also supplied images of plastic vials allegedly used by Combs or his staffers to slip GHB — a date-rape drug — into drinks, the lawsuit claims.

11 Sean “Diddy” Combs was seen dancing while surrounded by booze and young women in new photo evidence submitted in court. Supreme Court of New York

11 The rapper was captured dancing in what appeared to be a hotel suite where young ladies had gathered. Supreme Court of New York

11 Another image shows what a victim claims was a container used by Diddy or his staffer to slip a date-rape drug into partiers’ drinks. Supreme Court of New York

The attorney’s latest filing alleges that the music mogul sexually assaulted at least seven victims, one of whom was just 13 at the time.

The now-37-year-old woman claims that Combs, 54, and two other celebrities raped her at a 2000 MTV Video Music Awards afterparty.

“Combs aggressively approached Plaintiff with a crazed look in his eyes, grabbed her and said, ‘You are ready to party!’” the 19-page action filed in New York federal court Sunday stated.

11 One male victim claimed that Diddy attempted to assault him at a Ciroc party around 2022. USDC / SDNY

11 The victim allegedly took a photo of Combs sitting with “high-profile individuals” at a party. SDNY/MEGA

The anonymous victim was held down by a male celebrity who “vaginally raped her” while Combs and a female celebrity “watched,” the lawsuit claims.

“After the male celebrity finished, Combs then vaginally raped Plaintiff while the Celebrity A and Celebrity B watched,” the documents state.

Another client of Buzbee, an unnamed luxury car businessman, claims that Combs attempted to assault him at a Ciroc party around 2022 but was stopped by a professional athlete.

11 The music mogul, seen here in 2004, is also accused of raping a woman at an MTV VMAs afterparty when she was just 13 years old. Getty Images

11 Diddy, seen here in 2023, was hit with at least five new accusations this week. Getty Images

The male victim submitted an image that he claimed was from the evening the incident occurred. The eerie snap shows Combs sitting on a couch with “other high-profile individuals,” though their faces have been blurred.

Buzbee, who announced he was representing 120 individuals in civil lawsuits accusing Combs of egregious sex crimes, filed at least five new civil lawsuits in the Southern District of New York this week. In the new motion, one of the men and all three women accused the Bad Boy Records founder of drugging them.

Combs’ legal team has denied the accusations, telling Page Six in a statement, “Mr. Combs and his legal team have full confidence in the facts, their legal defenses, and the integrity of the judicial process. In court, the truth will prevail: that Mr. Combs has never sexually assaulted anyone — adult or minor, man or woman.”

11 Combs, seen here in 2009, has denied any wrongdoing via his attorneys. FilmMagic

11 The rapper, seen here in 2009, was arrested last month and charged with racketeering conspiracy, sex trafficking and transportation to engage in prostitution. Ethan Miller

Want more celebrity and pop culture news? Start your day with Page Six Daily. Thanks for signing up! Enter your email address Please provide a valid email address. By clicking above you agree to the Terms of Use and Privacy Policy. Want celebrity news as it breaks? Hooked on Housewives? Check out more newsletters

The “I’ll Be Missing You” artist has maintained his innocence after being hit with a wave of accusations this year.

Combs first denied any wrongdoing in November 2023 when his ex-girlfriend Casandra “Cassie” Ventura filed a lawsuit accusing him of raping, sex-trafficking and physically abusing her throughout their decade-long relationship.

Combs settled the case less than 24 hours later but was forced to issue a public apology when a video of him violently assaulting the “Me & U” singer at a hotel in 2016 surfaced online.

11 Dozens of victims claim Combs drugged and sexually assaulted them at parties. SDNY/MEGA

11 He was sued for allegedly raping his ex-girlfriend, Cassandra “Cassie” Ventura, in 2023. WireImage for Porter Novelli- NY

From there, the father of seven was hit with dozens more abuse allegations.

The Grammy winner was arrested last month and charged with racketeering conspiracy, sex trafficking and transportation to engage in prostitution.

Combs pleaded not guilty to the charges and is being held behind bars at the Metropolitan Detention Center in Brooklyn, NY, after being denied bail.

If you or someone you know is affected by any of the issues raised in this story, call the Sexual Assault Hotline at 1-800-330-0226.",851,"court, party, mysterious, young, vodka, combs, released, male, filed, women, diddy, vials, photos, newly, surrounded, seen, sean, celebrity, victim"
