Index,Topic,Content,Word_count,Key_words
1,tapestry capri ftc merger would said federal order injunction decision,"A federal judge blocked Tapestry's acquisition of Capri on Thursday following a brief trial last month in New York.

In her order, Judge Jennifer Rochon granted the Federal Trade Commission's motion for a preliminary injunction to block the proposed merger, which would marry America's two largest luxury houses and put six fashion brands under one company: Tapestry's Coach, Kate Spade and Stuart Weitzman with Capri's Versace, Jimmy Choo and Michael Kors.

Tapestry's stock surged 10% after the order was filed while Capri's plunged about 50%.

In a statement, Tapestry said it plans to appeal the order, ""consistent with our obligations under the merger agreement.""

""Today's decision granting the FTC's request for a preliminary injunction is disappointing and, we believe, incorrect on the law and the facts. Tapestry and Capri operate in an industry that is intensely competitive and dynamic, constantly expanding, and highly fragmented among both established players and new entrants,"" the company said. ""We face competitive pressures from both lower- and higher-priced products and continue to believe this transaction is pro-competitive and pro-consumer.""

Under the terms of the merger agreement, Tapestry agreed to reimburse Capri for expenses incurred in connection with the transaction if it fails to be approved, according to a securities filing. If either Tapestry or Capri walks away from the deal because it didn't receive regulatory approval or, a government issued a permanent, non-appealable injunction against it, Tapestry agreed to pay Capri between $30 million and $50 million, the filing said.

Capri, on the other hand, has agreed to pay a breakup fee of $240 million if it decides to terminate the proposed merger.

Rochon's reasoning behind the order wasn't immediately clear. A detailed opinion was filed under seal and isn't currently accessible to the public.

The former rivals and longtime competitors announced the $8.5 billion deal more than a year ago but the Federal Trade Commission sued to block it in April and sought a preliminary injunction to stop the agreement.

The FTC argued if the companies merged, it would harm consumers by making the affordable handbag market less accessible and would leave employees with worse salaries and benefits. Tapestry argued consumers would be better off if it merged with Capri because it would allow them to keep up with trends faster, offer better products and reach more customers.

""Today's decision is a victory not only for the FTC, but also for consumers across the country seeking access to quality handbags at affordable prices,"" Henry Liu, director of the FTC's Bureau of Competition, said in a statement. ""These bags are a product which millions of people rely on throughout their daily lives. The decision will ensure that Tapestry and Capri continue to engage in head-to-head competition to the benefit of the American public.""

The decision comes at a time when consumers are more price-sensitive than ever after years of elevated inflation. The Biden administration, and Democratic presidential candidate Vice President Kamala Harris, have pushed for the federal government to use its power to maintain competition and help keep prices low. Republican candidate Donald Trump has also criticized inflation and has pushed for tariffs to address the issue.

The FTC under Chair Lina Khan has moved to block mergers and acquisitions in the grocery, technology and apparel spaces.

During the trial last month, key witnesses called by the FTC cited research that showed the merger could raise prices for handbags, accessories and apparel, and may give the combined company little incentive to invest in product quality.

Lawyers for Tapestry and Capri argued the companies are not each other's main competitors. They said shoppers now have more options than ever in the handbag market, and trends can change in a blink in the era of TikTok.

— CNBC's Melissa Repko contributed to this report",627,"owner, order, parent, prices, tapestry, judge, tapestrys, proposed, michael, decision, consumers, injunction, ftc, capri, coach, blocks, merger, kors, federal"
2,tesla billion quarter earnings higher year said growth expected q3,"Tesla stock (TSLA) surged on Thursday after investors focused on the positive from mixed third quarter earnings results.

Investors cheered beats on adjusted earnings per share and higher gross margins in addition to the news that Tesla's cheaper electric vehicle is on track for production next year. CEO Elon Musk also said on an earnings call that Tesla's volume growth could be 20%-30% next year.

Tesla shares ended nearly 22% higher, adding tens of billions of dollars to the company's market valuation in its best day since 2013.

• USD (TSLA) View Quote Details

Tesla reported revenue of $25.18 billion, which was lower than the $25.4 billion expected per Bloomberg consensus but higher than the $25.05 billion it reported in Q2 and also topped the $23.4 billion Tesla reported a year ago. Tesla posted adjusted earnings per share of $0.72 vs. $0.60 expected, on adjusted net income of $2.5 billion and free cash flow of $2.9 billion.

The closely watched gross margin figure came in at 19.8%, much higher than the 16.8% expected.

""We delivered strong results in Q3 with growth in vehicle deliveries both sequentially and year-on-year, resulting in record third-quarter volumes,"" the company said in its earnings deck. ""Preparations remain underway for our offering of new vehicles — including more affordable models — which we will begin launching in the first half of 2025.""

Earlier this month, Tesla announced third quarter deliveries that slightly missed expectations, sending the stock lower.

Tesla said it delivered 462,890 vehicles in Q3, up 6.4% quarter over quarter, to mark the first quarter of delivery growth this year. The numbers also came in ahead of the 435,059 EVs the company delivered in the year-ago period. But Wall Street had expected Tesla to deliver closer to 463,897, according to Bloomberg.

""Refreshed Model 3 ramp continued successfully in Q3 with higher total production and lower cost of goods sold quarter-over-quarter. Cybertruck production increased sequentially and achieved a positive gross margin for the first time,"" Tesla said in its report.

Tesla said it expects vehicle deliveries to achieve ""slight growth"" in 2024. CEO Elon Musk added during the conference call that 20%-30% growth next year is possible, though he couched it as a ""best guess.""

Ahead of Tesla's Q3 disclosure, shares were down approximately 11% since Tesla revealed its robotaxi, dubbed the Cybercab, at its showy “We, Robot” event at the Warner Bros. studio lot in Burbank, Calif., on Oct. 10.

Investors and analysts were left wanting more details from Tesla’s “We, Robot” event on the Cybercab itself and detailed testing plans, along with questions about the development of Tesla’s sub-$30,000 EV, dubbed the Model 2.

Story Continues",442,"higher, cheer, day, soars, teslas, best, growth, stock, billion, vehicle, quarter, reported, investors, earnings, q3, tesla, report"
3,costco membership scanners front counts customers netflix card stores paying,"Costco’s introduction of membership card scanners at the front of US stores is still rolling out, but the move is already paying off big for the wholesale club.

Morgan Stanley analysts wrote in a note this week that Costco warehouses are seeing as much as low double-digit increases in membership counts after implementing the scanners, and suggested the high conversion rates of previously non-paying customers could lead to the retailer’s “Netflix moment.”

The report, led by Simeon Gutman, acknowledged that Costco and Netflix have two very different business models, but suggested the warehouse club’s new tool for checking memberships could lead to the kind of growth in paying customers that the streaming giant saw after it cracked down on password sharing.

Since limiting password-sharing last year, Netflix has seen a significant surge in new accounts.

In the first quarter of 2024 alone, the streaming company added 9.3 million sign-ups – a five-fold increase compared to the same quarter in 2023.

“Our base scenario suggests Costco could capture an additional 4 million members through conversion of nonfee paying customers in North America,” the Morgan Stanley analysts wrote.

Morgan Stanley analysts wrote in a note this week that Costco warehouses are seeing as much as low double-digit increases in membership counts after implementing the scanners Getty Images

During Costco’s fourth quarter earnings call last month, CEO Ron Vachris noted that the company has used card readers at the front of its stores in Europe for more than two years now and has been piloting the system in the US for roughly six months.

He pointed to several ways the scanners help Costco improve operational efficiency at stores.

“It gives our operators real-time traffic counts throughout the day. So, we’re able to adjust front-end lines that we need to open and close lines based on the fluctuations of business,” Vachris explained.

Since limiting password-sharing last year, Netflix has seen a significant surge in new accounts. Koray – stock.adobe.com

“We can monitor our fresh foods a little better because we know what the traffic counts look like and so forth,” he said, “and it has also taken the friction of membership verification away from the front-end registers and moved that to the front door, where we’re able to look at people’s membership status.”

The Costco chief added that the scanners also allow customers to be notified if their membership renewals are due before they reach the front end of the store, “and the membership card scanners installed at the front doors have delivered on the goal of speeding up the checkout process.

“This has been very well received by our members.”",437,"card, costco, moment, membership, netflix, counts, stanley, membershipboosting, paying, scanners, customers, quarter"
4,tesla musk car said wheel idea company steering pedals robotaxi,"The idea of a $25,000 Tesla has persisted for years — in part, perhaps, because CEO Elon Musk said he was “very confident” the company could do it at an event in 2020.

But on Wednesday night, during Tesla’s third-quarter earnings call, Musk said the idea of a $25,000 car with a steering wheel and pedals is “pointless,” and “silly.” He said he only wants to sell one car at that price: the “Cybercab” robotaxi he revealed a prototype of two weeks ago.

It was the latest in a long line of public and private flip-flopping from Musk, a process that has so muddied the waters about Tesla’s future product portfolio that some of his company’s most ardent supporters have confidently and wrongly proclaimed that the idea of a drivable $25,000 Tesla — with a steering wheel and pedals — never existed.

But it did. Here’s how we got here.

Battery Day

Musk surfaced the idea of a $25,000 Tesla in 2020 at the company’s so-called “Battery Day” event. It was a showcase of the new in-house battery cells Tesla was working on, which were larger and more energy dense. Those advancements were supposed to help drive down the cost of the most expensive piece of any EV, the battery pack. And they would enable Tesla to sell a car for $25,000, Musk said.

“I think probably three years from now we’re confident we can make a very compelling $25,000 electric vehicle, that’s also fully autonomous,” he said.

You could take that one of two ways. Either he meant the car would be a robotaxi like the Cybercab, with no steering wheel or pedals. Or he was talking about a car with a wheel and pedals that, like he has promised about all other Teslas, would one day receive a software update that made it autonomous. For what it’s worth, Musk reportedly was unsure about whether it would or wouldn’t be manually drivable in a September 2021 meeting.

But it’s not worth spending time arguing what exactly Musk meant. Because his own biographer found out.

Two cars

Musk announced in January 2022 that Tesla was “not currently working on the $25,000 car,” saying at the time that Tesla still planned to do it, but that the company had too much on its plate. He also said that making Tesla’s cars autonomous was more important than designing a car for that price point.

Musk’s biographer, Walter Isaacson, found out what happened next. In his biography, Isaacson describes that Musk and his top lieutenants spent months hashing out whether to pursue the robotaxi idea, or a more traditional car.

Isaacson describes Tesla’s chief designer Franz von Holzhausen trying to convince Musk in an August 2022 meeting that making a car with no steering wheel or pedals was risky if the company couldn’t get its Full Self-Driving software ready in time.

“He suggested that they make a car that had a steering wheel and pedals that could be easily removed,” Isaacson wrote of von Holzhausen’s pitch. Here’s what followed:

“No,” Musk said. “No. NO.” There was a long pause. “No mirrors, no pedals, no steering wheel. This is me taking responsibility for this decision.”



The executives sitting around the table hesitated. “Uh, we will come back to you on that,” one said.



Musk got into one of his very cold moods. “Let me be clear,” he said slowly. “This vehicle must be designed as a clean Robotaxi. We’re going to take that risk. It’s my fault if it f—s up. But we are not going to design some sort of amphibian frog that’s a halfway car. We are all in on autonomy.”



But von Holzhausen and Tesla engineering VP Lars Moravy did not drop the idea of a manually drivable car — if only because they saw it as a hedge to the risk that Tesla would either be slow to get the software right, or that it would run into regulatory red tape.

So they kept working on the more traditional design in secret.

In September 2022, according to Isaacson, von Holzhausen and Moravy convinced Musk that the right approach was to develop both vehicles. Musk was initially not thrilled, as Isaacson tells it. But by February 2023, when von Holzhausen showed Musk models of “the Robotaxi and the $25,000 car next to each other in the studio,” Musk “loved the designs.”

“The new mass-market vehicle, both with a steering wheel and as a Robotaxi, became known as ‘the next generation platform,’” Isaacson wrote.

The report

The idea that Tesla was building two different vehicles on this next-generation platform held for about a year, until Reuters published a bombshell story in April 2024: Tesla had scrapped plans to build a manually operable $25,000 car in favor of just pursuing the robotaxi.

It appeared Musk had flipped again. In response, he claimed — without offering proof — that Reuters was “lying.” But a few weeks later when Tesla released its quarterly results, the company tacitly admitted the report was right.

Tesla confirmed in that quarter’s shareholder letter that it was still pursuing a robotaxi design. But it also said it was working on “new vehicles, including more affordable models” that would “utilize aspects of the next generation platform as well as aspects of our current platforms, and will be able to be produced on the same manufacturing lines as our current vehicle line-up.” This is a very different plan from the $25,000 car that Musk approved in February 2023, according to Isaacson.

To this day, the company has not explained what these new models will look like. Some have speculated that Tesla is developing even-more-pared-down versions of the Model 3 and Model Y. What seems clear from subsequent earnings releases is that Tesla is accomplishing those further cost reductions by using ideas from the next-generation platform — ideas that were meant for the $25,000 car that was going to be built on that platform — and building them on existing production lines.

How low is Tesla trying to go with those cost reductions? The company hasn’t said, and it no longer has a public relations department. The Model 3 currently starts at around $42,000. Musk now says a $25,000 car is “silly” and “pointless.” Maybe finally delivering a car at the long-promised $35,000 price tag that the Model 3 was supposed to sell at is a more serious idea.

Whatever the answer winds up being, just remember this the next time anyone questions it: Tesla really was at one point working on a $25,000 car with a steering wheel and pedals.",1098,"idea, teslas, isaacson, 25000, wheel, flipflop, car, pedals, explained, ev, robotaxi, steering, tesla, musk"
5,amazon bp prime members advertisement gas savings mcdonald facing first,"Amazon (AMZN+0.83% ) subscribers pony up for Prime in exchange for free two-day shipping, discounts on services such as Grubhub, and access to films and TV shows on Prime Video. Now they can add gas savings to that list.

McDonald’s is facing its first lawsuit from the Quarter Pounder E. coli outbreak CC Share Subtitles Off

English view video McDonald’s is facing its first lawsuit from the Quarter Pounder E. coli outbreak

McDonald’s is facing its first lawsuit from the Quarter Pounder E. coli outbreak CC Share Subtitles Off

English McDonald’s is facing its first lawsuit from the Quarter Pounder E. coli outbreak

Amazon announced Wednesday that Prime members can now now save $0.10 per gallon at approximately 7,000 BP-affiliated (BP+0.69% ) gas stations across the country, including Amoco and Ampm.

Advertisement

For the average U.S. driver, this could translate to nearly $70 in annual savings, according to Amazon. Amazon Prime memberships start at $14.99 a month or $139 a year.

Advertisement

“We’re always asking ourselves how Prime can save members more money, and fuel savings is our latest offer that puts money back into members’ wallets,” the e-commerce giant said in a blog post announcing the perk.

Advertisement

Amazon added that it plans to expand these transportation-related savings to EV drivers in 2025, with an EV charging savings offer at BP pulse, which is BP’s electric vehicle charging business.

How does it work?

To unlock $0.10 off per gallon, Prime members will need an account with Earnify, a gas loyalty program from BP. Subscribers then must visit a page set up by Amazon to activate the offer and link their Amazon account with Earnify.

Advertisement

Members can use the Earnify app’s store locator to find nearby BP, Amoco, or Ampm gas stations. To redeem the offer, members must enter their phone number or linked payment method at the pump. Or, they can use the Earnify app to select the station and pump.

Behind the deal

BP and Amazon started working together publicly at the end of 2019. At the time, BP said it would supply renewable energy to Amazon Web Services (AWS) data centers in Europe, while Amazon said BP would migrate data to AWS. In each announcement, the companies cited BP’s environmental efforts.

Advertisement

Yet, Reuters reported earlier this month that BP has cast aside its pledge to lower its oil and gas output by 2030.

Other tech and energy giants have recently scaled back some of their own environmental promises, including ExxonMobil, Shell, and Google.

Advertisement

Harri Weber contributed to this report.

Read more",427,"amazon, savings, pounder, prime, lawsuit, gas, bp, members, offer, comes, works, quarter, discount, heres"
6,boeing spirit furloughs machinists strike said weighing spokesman week wednesday,"Spirit AeroSystems is weighing furloughs or layoffs of hundreds more employees if the Boeing machinists' strike stretches beyond Nov. 25, a company spokesman told CNBC on Thursday.

Boeing's machinists, whose strike is about to enter its sixth week, voted 64% against a newly proposed labor contract on Wednesday, extending the work stoppage that has halted production of most of Boeing's aircraft, which is centered in the Seattle area.

Spirit, which makes fuselages for Boeing's best-selling 737 Max as well as other major parts, had already been preparing to temporarily furlough about 700 workers in its Wichita, Kansas, facilities. Those 21-day furloughs could begin next week.

Further reductions would be in addition to those furloughs, but no decision has been made, said Spirit spokesman Joe Buccino.

Spirit's consideration of additional furloughs demonstrates how the lengthy strike is weighing on an already-fragile aerospace supply chain. Boeing suppliers have largely hesitated to cut staff in part because they had spent years rebuilding their workforces in the wake of the Covid-19 pandemic. Airbus is also facing similar supply chain pressure.

More than 32,000 Boeing machinists in the Puget Sound area, Oregon and other locations walked off the job on Sept. 13 after turning down an earlier tentative agreement.

Boeing is in the process of acquiring Spirit, a deal it expects to close next year. Spirit has been burning through cash and, on Wednesday, reported a third-quarter net loss of $477 million, more than double a year earlier.

Boeing's new CEO Kelly Ortberg has said getting a deal with its Seattle-area machinists and ending the strike is a top priority, and the workers' union has said it is eager to get back to the negotiating table.",281,"furloughs, deal, weighing, supply, strike, layoffs, hundreds, spokesman, workers, boeing, machinists, weighs, goes, aerosystems, nov, spirit"
