Index,Topic,Content,Word_count,Key_words,Date
17,bus said police los angeles dodgers win people set fire,"A bus was set on fire, shops were looted and fireworks were thrown at police in scenes of lawlessness and ""absolute chaos"" in downtown Los Angeles following the Dodgers' World Series win over the New York Yankees on Wednesday night.

Los Angeles police said at 10:43 p.m. (1:43 a.m. ET Thursday) on X that there were reports of several stores being looted on Broadway and 8th Street. Various videos posted to social media, including one shared by the official police X account, showed people walking out of a Nike store holding goods.

A dozen people were arrested in connection with the disturbances, police said. Six people were taken into custody on suspicion of commercial burglary, four of receiving stolen property and two others of failure to disperse.

Police issued a dispersal order because of fireworks and projectiles being thrown at officers. Then a ""hostile crowd"" surrounded a bus on Echo Park Avenue, a short distance from Dodger Stadium, at around 12:35 a.m. and set it on fire, police said.

The driver and five passengers managed to leave the bus before the fire started, the transit authority said.

A person loots items from a ransacked Nike store in Los Angeles on Thursday morning after the Dodgers' World Series win. Ethan Swope / AP

Los Angeles resident Taylor Rosa, 27, a witness, told NBC News the celebrations turned ugly.

""It's been absolute chaos. People were excited and having a good old time, but people got out of control and started looting and jumping on top of a bus,"" he said.

Rosa said a female driver was still inside when the crowd surrounded the bus: ""After she got out, they all started lighting fireworks inside the bus, jumping on top of the bus, dancing.""

Fans celebrate the Dodgers' win Wednesday night. Damian Dovarganes / AP

He said that as police issued a dispersal order, someone set off an explosive inside the bus and it ""completely blew up."" Rosa, who said he didn't see whether was injured, described the streets as ""completely destroyed,"" with fireworks launched at several local businesses.

The Los Angeles County Metropolitan Transportation Authority said in a statement: ""Metro is disappointed and angered by the senseless act of vandalism on one of our buses following the Dodgers World Series Win earlier this evening.

""We are thankful that the bus operator and the five passengers were safely evacuated before the bus was set on fire.""

The Dodgers beat the Yankees 7-6 in Game 5 on Wednesday to win the World Series four games to one.",423,"los, angeles, world, bus, win, hit, fireworks, looting, dodgers, la, celebrations, amid, set, started, series, chaos",2024-10-31
18,election musk x officials cnn said state misinformation claims benson,"CNN —

Elon Musk’s misinformation megaphone has created a “huge problem” for election officials in key battleground states who told CNN they’re struggling to combat the wave of falsehoods coming from the tech billionaire and spreading wildly on his X platform.

Election officials in pivotal battleground states including Pennsylvania, Michigan and Arizona have all tried – and largely failed – to fact-check Musk in real time. At least one has tried passing along personal notes asking he stop spreading baseless claims likely to mislead voters.

“I’ve had my friends hand-deliver stuff to him,” said Stephen Richer, a top election official in Arizona’s Maricopa County, a Republican who has faced violent threats for saying the 2020 election was secure.

“We’ve pulled out more stops than most people have available to try to put accurate information in front of (Musk),” Richer added. “It has been unsuccessful.”

Ever since former President Donald Trump and his allies trumpeted bogus claims of election fraud to try to overturn his loss to Joe Biden in 2020, debunking election misinformation has become akin to a second full-time job for election officials, alongside administering actual elections. But Musk – with his ownership of the X platform, prominent backing of Trump and penchant for spreading false claims – has presented a unique challenge.

“The bottom line is it’s really disappointing that someone with as many resources and as big of a platform as he clearly has would use those resources and allow that platform to be misused to spread misinformation,” Michigan Secretary of State Jocelyn Benson told CNN, “when he could help us restore and ensure people can have rightly placed faith in our election outcomes, whatever they may be.”

Benson has come the closest to matching Musk on social media. She pushed back on a claim he made about registered voters in the Wolverine State, accusing Musk of spreading misinformation. Her post, by the measurement posted on X, gained more than 33 million views.

It still failed to sway Musk, who accused Benson of “blatantly lying to the public.”

Such is the conundrum for officials in key battleground states six days before Election Day: They haven’t identified how to neuter the misinformation Musk has increasingly amplified to his 200 million followers and allowed to permeate on the X, formerly known as Twitter, platform with little intervention.

A spokesperson for X did not address Musk’s activities but said X is enforcing its policies related to election interference and misleading content.

CNN has sent questions about election officials’ concerns to an email address associated with Musk. CNN has also requested comment from one of Musk’s attorneys.

Election officials say they are simply outmatched up against Musk’s followers and the X algorithm.

“Election officials, they have a very hard job – their job is to be election officials not to be Tweeters,” said Renée DiResta, an expert in disinformation and an associate research professor at Georgetown University’s McCourt School of Public Policy.

“If no algorithm is going to boost your content in any way but it is boosting the contents of prominent people who are deeply suspicious of elections and tweeting conspiracy theories, you’re at a structural disadvantage,” DiResta added.

This week Musk directed his followers to report election irregularities to an “Election Integrity Community” on X. The feed is administered by Musk’s America PAC, which is bolstering Trump’s campaign. The feed included some election claims that had already been debunked by state officials.

“It’s just a staggering situation with him at the helm,” said Nina Jankowicz, CEO of the American Sunlight Project, which aims to expose disinformation. “I don’t know if anything can fact-check him.”

Personal and security risks

Benson said her strategy of trying to fact-check Musk on X comes with a personal risk.

“The first time he attacked our election system, I had to take a beat and realize that if I were to respond as I did, ultimately, I’d have to check to make sure my family was safe first, and I’d called my security team and let them know to expect an uptick in threats and all the rest, and that’s very real,” she told CNN.

“But that doesn’t mean we shouldn’t try consistently, with the truth on our side, to make sure the facts get out there,” Benson added.

Benson also said her team has attempted to find unique ways to get accurate information about the election out to voters in Michigan by empowering trusted messengers to share it. This week, her office gathered business and labor leaders to brief them on how the state ensures every valid vote is tabulated on election night and beyond.

Election officials in Pennsylvania are similarly attempting to fact-check Musk’s false claims on X but acknowledge those efforts are unlikely to stymie the spread of election lies.

“Elon Musk is a huge problem,” one Pennsylvania election official said. The official told CNN the strategy at this point is more about “creating a paper trail” that various claims have been debunked should they appear in any post-election legal challenges as they did in 2020.

Musk is also making headlines in Pennsylvania as he is trying to move a lawsuit over his $1 million giveaway to voters into federal court, potentially averting a hearing Thursday in Philadelphia state court that he was required to attend. At the center of the legal battle is a daily $1 million sweepstakes that Musk’s pro-Trump super PAC, called America PAC, is offering to registered voters in battleground states.

His lawyers filed a “motion of removal” in federal court late Wednesday night. This typically pauses the state case and puts the matter in the hands of a federal judge – unless and until that judge decides to send the case back to state courts.

In Georgia, election officials see little point in trying to engage with Musk directly, instead turning to the method they relied on in 2020 to beat back misinformation: Regular press conferences with election officials rebutting the latest election falsehoods.

The conservative backlash against social media companies monitoring platforms for misleading information around elections has had a chilling effect on social media sites beyond X. But an official in one battleground state said they at least have a point of contact for companies like Meta, whereas executives at X are effectively unreachable.

For experts like Jankowicz, who has been criticized by Republicans and was called to testify before Republican House Judiciary Chairman Jim Jordan’s so-called weaponization of government subcommittee, it’s a dark irony that they’ve been silent on Musk’s activism.

“What Elon Musk is doing – the campaigning that he’s doing, the donations that he is making, the way he has engineered Twitter to be a maelstrom of conservative disinformation – is far closer to election interference than any of the allegations that conservatives have made against social media platforms from 2016 to 2022,”Jankowicz said.

Video Ad Feedback ""So wrong"": Pennsylvania nuns falsely accused of voter fraud 03:56 - Source: CNN

Among Democrats on Capitol Hill, there is concern that social media platforms are wholly unprepared for the deluge of misinformation about voting in the days before and after Election Day.

“I don’t feel I’ve got a full answer yet from the platforms themselves of what they’re going to do to surge capabilities both those last few days pre-election and the few days post-election,” Sen. Mark Warner, the Virginia Democrat who chairs the intelligence committee, told CNN.

At a September 18 hearing Warner’s committee held on foreign election influence and social media firms, X was conspicuously absent.

“Our invited witness was X’s Head of Global Affairs, Nick Pickles, who resigned on September 6,” an X spokesperson said via email. The spokesperson did not reply when CNN asked why the company did not send someone to the hearing in Pickles’ place.

This story has been updated with additional developments.",1305,"misinformation, outmatched, elon, officials, media, musks, x, election, musk, state, machine, social, cnn",2024-10-31
19,trump campaign new world series dodgers states harris two musk,"Donald Trump takes his campaign to New Mexico, one of several blue-state stops. The Los Angeles Dodgers take home a World Series title. And a trip underground to see a 600-ton sphere that scientists hope will help unlock the universe’s mysteries.

Here’s what to know today.

Trump’s unconventional final-week campaign stops

New Mexico. Virginia. New Hampshire. They're states where former President Donald Trump is trailing Vice President Kamala Harris by more than 5 points in recent polls, where he lost by double digits in 2020 and where the GOP nominee for president hasn't been elected in two decades. Yet Trump is lined up to host rallies in the first two states and is flirting with a trip to the third. A visit to Albuquerque, New Mexico, is on the agenda today.

This is Morning Rundown, a weekday newsletter to start your day. Sign up here to get it in your inbox.

The visits to these states in the final week of the presidential campaign seem to show the Trump campaign is confident that he is in such good shape to beat Vice President Kamala Harris that he can afford to divert focus from the seven main battleground states the two sides have focused on for the entirety of the race. Harris, in comparison, is scheduled to visit Phoenix today, as well as Reno and Las Vegas.

However, both candidates campaigned in coveted battleground Wisconsin yesterday, where Harris tied to court young voters while Trump donned an orange vest and climbed into a garbage truck to highlight comments made by President Joe Biden a day earlier. (Harris also spoke out against Biden's comments.)

A Trump campaign official said the visits to non-battleground states are part of a strategy to capitalize on what the campaign says are Trump’s diverse coalition and favorable positioning on the map. Another Trump campaign official said that if it is going to a state, it’s because the campaign sees movement there.

But questions are swirling about whether Trump’s campaign is high on its own supply or grounded in a reality that public polls have missed. The unexpected destinations, plus Trump’s Madison Square Garden rally last weekend in deep-blue New York, has led some Republicans to infer that Trump is overruling the political pros on his team.

Read the full story here.

More election coverage:

➡️ With the presidential election looking extremely close in polls, it’s possible results could hinge on a recount in a battleground state. Here’s how the process works in seven key states. Plus, how ballot-counting rules differ across these states.

➡️ Trump said in a campaign rally speech that he would “protect” women, “whether the women like it or not.”

➡️ Trump and his allies are calling out routine election processes as signs of fraud in Pennsylvania. The playbook is familiar.

➡️ Reggaeton star Nicky Jam backtracked on his endorsement of Trump over the Puerto Rico “garbage” joke made at a rally last weekend.

➡️ Backers of Nikki Haley are turned off by Trump’s harsh and sometimes racist rhetoric. But for some, their dislike of Harris is stronger.

➡️ Haley, meanwhile, told voters at stops in Pennsylvania to put aside their feelings about Trump and “focus on the policies.”

➡️ An officer who fought off a pro-Trump mob on Jan. 6 and was also on duty for Harris’ speech this week at The Ellipse compared the two events: “Didn’t do that on the 6th.”

How Elon Musk turned X into a pro-Trump echo chamber

Before Elon Musk owned X, the app then known as Twitter was regarded as a global town square. When Musk offered to buy the app in April 2022, he pledged that the platform wouldn’t take sides in politics. It hasn’t worked out that way.

Musk has transformed the platform into an echo chamber in the two years since his purchase. Right-leaning causes are amplified, in particular former President Donald Trump’s electoral campaign, according to academic research, public opinion surveys, data on X’s most influential users, engagement metrics and reports about X’s working directly with the Trump campaign. And in recent months, Musk has become one of Trump’s biggest donors and supporters.

All told, Musk’s structural changes to the app have tilted in favor of far-right users and posts, researchers say. Look back at how Musk has reshaped the platform under his leadership.

Los Angeles Dodgers win the World Series

The Los Angeles Dodgers celebrate as they defeat the New York Yankees 7-6 in Game 5 to win the World Series on Oct. 30. Getty Images

The Los Angeles Dodgers are 2024 champions after winning Game 5 of the World Series in a thrilling 7-6 win against the New York Yankees. The Yankees appeared to be cruising toward a victory, leading 5-0 headed into what would end up being a consequential fifth inning. Instead, the team made three huge fielding mistakes that allowed the Dodgers to tie up the game. Here’s what happened.

New York retook the lead in the sixth inning, but two sacrifice flies by Los Angeles in the top of the eighth inning put the Dodgers in the lead for good.

This marks the Dodgers’ second World Series in the last five years. First baseman Freddie Freeman won World Series MVP. It also marks a first World Series for superstar Shohei Ohtani. Relive highlights from last night’s game.

More World Series coverage:

Ohtani is a national hero across Japan — and especially in his rural hometown , where fans gathered for a World Series watch party to witness the “once-in-a-century” talent.

, where fans gathered for a World Series watch party to witness the “once-in-a-century” talent. The two Yankees fans who interfered with Mookie Betts’ Game 4 catch were banned from Game 5, and the tickets were given to a 15-year-old cancer patient and his family.

Floods kill at least 95 in Spain

More downpours are in the forecast today in Spain, a day after at least 95 people were killed and many others are still missing after torrential rain in parts of the country, local authorities said. It’s the country’s worst natural disaster in nearly 30 years and the deadliest rain event in Europe since 2021.

Some areas recorded nearly 8 inches of rain that turned roads into rivers and disrupted highways and railway lines. One town got more than 19 inches of rain in just eight hours. Here’s what else we know.

Read All About It

Staff Pick: The race to solve a scientific mystery

Journalists take pictures at the top of the sphere at the Underground Neutrino Observatory, in Jiangmen, Guangdong province, China on Oct. 11. Eric Baculinao / NBC News

Some 2,300 feet below the Earth’s surface in China is a 600-ton plexiglass sphere that looks like something from a sci-fi flick. Soon, Chinese scientists will fill the sphere with liquid, seal it shut and never open it again, in hopes that they’ll catch a glimpse of the tiniest particles known to physicists: neutrinos. The sphere is meant to usher in a new wave of international research that could untangle the last mysteries of the Big Bang or identify new phenomena in physics.

Earlier this month, Beijing-based producer Eric Baculinao went to southern China and traveled deep underground for an up-close look at the 13-story sphere before it was too late. This story gave me the opportunity to work hand-in-hand with our Beijing bureau so we could share the story of Eric’s unique and rare journey. — Evan Bush, science reporter

NBC Select: Online Shopping, Simplified

Fall is good hair season. Make it even better with these great leave-in conditioners, according to hairstylists. Plus, here are 24+ gift ideas for astrology lovers and for every zodiac sign, perfect for anyone who has ever asked, “What’s your sign?”

Thanks for reading today’s Morning Rundown. Today’s newsletter was curated for you by Elizabeth Robinson. If you’re a fan, please send a link to your family and friends. They can sign up here.",1326,"targets, sphere, world, rundown, win, campaign, morning, la, dodgers, trumps, series, president, trump, harris, states",2024-10-31
