Index,Topic,Content,Word_count,Key_words,Date
24,births said reproductive birth 1998 multiple triplet report assisted health,"CNN —

Giving birth to triplets, quadruplets or even more has become increasingly less common in the United States.

The rate of triplet and higher-order births in the US declined 62% between 1998 and 2023, according to a report published Thursday by the US Centers for Disease Control and Prevention. And the largest declines in rates were seen among mothers 30 and older.

This decline appears to be associated with how guidance has strengthened around the number of embryos transferred during the use of assisted reproductive technologies like in vitro fertilization, known as IVF, wrote the researchers, from the CDC’s National Center for Health Statistics.

Couples are more likely to have twins, triplets or more babies in a single pregnancy when using assisted reproductive technology because these fertility treatments may involve transferring multiple embryos into the uterus in hopes of resulting in a pregnancy.

More embryos not only increase the likelihood of a viable pregnancy, they raise the risk that the pregnancy could involve more than one fetus – hence, twins, triplets or more.

“Monitoring trends in triplet and higher order multiple births is important because women with a triplet/+ pregnancy are at higher risk of complications during pregnancy and their infants are at greater risk of preterm birth and infant death,” Joyce Martin, a researcher at National Center for Health Statistics and the main author of the report, said in an email.

As fertility treatments became more mainstream after the 1980s, there was a rise in the incidence of multiple births, said Dr. Micah Hill, president of the Society for Assisted Reproductive Technology, who was not involved in the new report.

In the early 2000s, the American Society for Reproductive Medicine and the Society for Assisted Reproductive Technology started to issue guidelines on how many embryos should be transferred under different scenarios. The guidelines were issued to help reduce the risk of complications for women undergoing fertility treatments, including the risk of preterm birth.

While the new data does not indicate how many multiple births have been conceived spontaneously versus through assisted reproductive technologies (ART) like IVF, the overall decline does appear to parallel the introduction of the guidelines.

Guidelines were released in 2004, Hill said, and updated in 2006, 2008, 2009, 2013, 2017 and 2021.

“If you look at the CDC’s numbers, you can sort of see these declines follow every year or two after these guidance updates have happened,” Hill said.

“These guidelines have evolved as the technology has evolved,” he said. “I think it’s been successful in making fertility treatments safer, which is really what we care about when we’re talking about reducing these higher-order multiples.”

In part, recommendations in the latest guidelines, published in 2021, range from recommending the transfer of only a single embryo at a time for patients younger than 35 to recommending no more than four untested early-stage embryos for patients older than 40.

It’s not just guidance around embryo transfers that has changed in the past decades, possibly leading to declines in triplets and higher-order births.

There also have been shifts in the use of fetal reduction during fertility treatments, a procedure to reduce the number of fetuses when a pregnancy with triplets or more occurs, said Dr. Amanda Williams, interim chief medical officer for the maternal and infant health nonprofit March of Dimes, who was not involved in the NCHS data.

Separately, she called the new NCHS report, showing a decline in triplets and higher-order multiple births, “fantastic news” for maternal and infant health.

“When you have three or more babies inside, you are at a markedly increased risk for preterm birth, for low birth weight, for infant mortality, for NICU stays, and then on the maternal side, increased risk for gestational diabetes, increased risk for gestational hypertensive disorders like preeclampsia,” she said. “So this is good news for families, because triplets and higher order pregnancies are so much riskier for mom and baby.”

A growing ‘public health concern’

In previous years, the rate of triplet and higher-order multiple births in the United States rose from 37 out of every 100,000 births in 1980 to an all-time high of about 194 births per 100,000 in 1998, according to the new report.

This “unprecedented rise” was tied to women giving birth at older ages and “the increased use of fertility treatments,” Martin and her co-author Michelle Osterman wrote in the report.

“The increase was of public health concern because of the greater risk of adverse maternal and infant health outcomes of triplet and higher-order births compared with twins and singletons,” they wrote.

But since 1998, the rate of triplet and higher-order multiple births in the United States dropped to around 74 out of every 100,000 births last year, the new data showed.

Between 1998 and 2009, rates declined but not significantly, falling 21% to around 154 per 100,000 births in 2009. It was from 2009 to 2023 when rates dropped significantly, by 52%, according to the new report, which is based on birth certificate data from the CDC’s National Vital Statistics System. Many people might remember 2009 as the year when Nadya Suleman, known in the media as Octomom, delivered eight babies in a single birth after undergoing IVF.

The new data also showed that the raw number of triplet and higher-order multiple births in the United States declined 65% between 1998 and 2023 – falling from a total of 7,625 births in 1998 to 6,340 births in 2009 to, more sharply, 2,653 births last year.

The new data “are reflective of what we have seen in fertility care” on the ground, said Dr. Asima Ahmad, an endocrinologist and fertility expert who serves as chief medical officer and co-founder of Carrot Fertility, a company that helps employers set up fertility benefits.

“Embryology labs have advanced over the years, which allows them to grow the embryos out further than they used to be able to years ago. There is also additional testing available that can give more information about the health of the embryo,” Ahmad, who was not involved in the new NCHS report, said in an email. “Given these advances, it’s becoming more common for a physician to transfer one embryo at a time to achieve the goal of a singleton pregnancy – the healthiest option for the pregnant person and the baby.”

When looking at the data by maternal age, the researchers found that from 1998 to last year, triplet and higher-order multiple birth rates declined 16% for mothers ages 20 to 24; 57% for mothers ages 25 to 29; 77% for mothers ages 30 to 34 and ages 35 to 39; and 67% for mothers 40 and older.

The researchers also found significant racial disparities.

Among White mothers, the triplet and higher-order multiple birth rate fell 71% from 1998 to last year. Triplet and higher-order births for Hispanic mothers fell 25% from 1998 to 2023.

However, the triplet and higher-order birth rate for Black mothers followed a different trend, climbing 21% from 1998 to 2009 and then not changing significantly from 2009 to 2023, resulting in an overall increase of 25% from 1998 to last year.

“The biggest drops were with White women over 30, and that is the group that would have the highest access to in vitro fertilization and actual transfer of embryos, where one could be making the decision to transfer fewer embryos,” March of Dimes’ Williams said.

But there are many other types of assisted reproductive technology, which could be factors driving these racial disparities, she said.

Get CNN Health's weekly newsletter Sign up here to get The Results Are In with Dr. Sanjay Gupta every Friday from the CNN Health team.

“When you think about Black women or you think about low-income women, they may not have access to the highest level of technology and IVF for their assisted reproductive technology,” Williams said.

“They may be using less technologically advanced means of assisted reproductive technology – such as clomiphene with insemination, where you’re going to be stimulating the ovaries to produce more eggs, therefore driving your numbers of twins and triplets,” she said. “So we can’t conflate assisted reproductive technology with IVF. There are less invasive, less technologically advanced forms of assisted reproductive technology that may be the ones that are being used by Black mothers and low-income mothers.”

Overall, the new data was “very informative,” Dr. Rachel McConnell, assistant professor of obstetrics and gynecology at Columbia University’s Vagelos College of Physicians and Surgeons, who was not involved in the report, said in an email.

She added that the report’s findings indicate that the guidelines set by the American Society for Reproductive Medicine to transfer a low number of embryos “has helped to reduce the number of multiple pregnancies” in IVF cycles.",1458,"higherorder, 1998, fertility, births, assisted, triplets, triplet, heres, common, united, birth, technology, multiple, reproductive, states",2024-10-31
25,tubs hot private cruise legionella ship disease according balcony cdc,"They got more than they paid extra for.

A dozen cruise ship passengers were sickened by Legionnaires’ disease — including 10 who were hospitalized — on two different ships, and health experts believe a private luxury amenity is the source, according to a new report.

The Centers for Disease Control and Prevention tracked the serious pneumonia-like sickness back to private balcony hot tubs offered on the higher-end cabins inside the two vessels, according to the study published last week.

The vacationers were sickened on the two different boats — from unidentified cruise lines — between November 2022 and this past July.

3 Private balcony hot tubs, which don’t require as stringent maintenance and cleaning as public hot tubs, were found to be the source of the outbreak of Legionnaires disease. ChiccoDodiFC – stock.adobe.com

After months of testing, the private hot tubs — which are not required to undergo as frequent and stringent cleaning and maintenance as their public counterparts — were found to be the source of the nasty outbreaks, the CDC said in its report.

Eight passengers on one cruise ship contracted Legionnaires’ disease while four were infected on the other boat. Some of the travelers became ill on the same voyage while others got sick on the same ship but during a different trip.

The hot tubs apparently created the perfect environment for the Legionella bacteria that causes Legionnaires’ disease for several months without detection.

On the first ship, the private balcony hot tubs “were found to be operating for months in a manner conducive to Legionella growth, which included maintaining a water temperature in the Legionella growth range (77°F–113°F) for multiple days without draining and operating with no residual disinfectant,” the CDC said.

3 A dozen people contracted Legionaries Disease on the two unnamed cruise ships from November 2022 through this past July. Mariakray – stock.adobe.com

3 Six of 10 private hot tubs on one boat and all eight on the other tested positive for Legionella bacteria, according to the CDC. CDC Vessel Sanitation Program

Six of the 10 private balcony hot tubs on the first ship were positive for Legionella bacteria, and all eight private balcony hot tubs on the second ship were positive for Legionella bacteria, according to testing results.

All the hot tubs were closed and thoroughly cleaned. Both cruise ships have since implemented more preventative measures including only filling the tubs upon guest request, draining them between uses, more frequent cleaning and disinfecting and the removal of heating elements.

Hot tubs — on cruise ships or elsewhere — are often perfect breeding grounds for Legionella bacteria.

But cruises are also known to be drivers of outbreaks of different viruses and diseases due to the tight proximity of guests in a closed-off environment.

At the end of last month, 180 Royal Caribbean cruise passengers and three crew members came down with a gastrointestinal illness featuring unpleasant symptoms like diarrhea and abdominal cramps, according to the CDC.",492,"cruises, according, tubs, legionella, linked, disease, amenity, hot, cdc, ship, luxury, private, report, outbreak, legionnaires, separate, cruise, balcony",2024-10-30
26,aging flies fruit accumulation brain buildup lifespan brains autophagy cellular,"Preventing F-actin buildup in aging fruit flies by altering specific genes enhanced cellular recycling, reduced waste accumulation, and extended their healthy lifespan by about 30%.

Humans aren’t the only ones who become more forgetful with age—fruit flies experience it as well. With a lifespan of just around two months, fruit flies serve as a valuable model for studying the cognitive decline associated with aging.

A new study published in Nature Communications shows that when a common cell structural protein called filamentous actin, or F-actin, builds up in the brain, it inhibits a key process that removes unnecessary or dysfunctional components within cells, including DNA, lipids, proteins, and organelles. The resulting accumulation of waste diminishes neuronal functions and contributes to cognitive decline. By tweaking a few specific genes in aging fruit flies’ neurons, the researchers prevented F-actin buildup, maintained cellular recycling, and extended the healthy lifespan of fruit flies by approximately 30%.

Actin, a family of proteins that help give cells their shape, are abundant throughout the body. F-actin forms filaments that are essential for maintaining cell structure and many other functions. The researchers, led by former postdoctoral scholar Edward (Ted) Schmid in David Walker’s lab, noticed F-actin buildup in the brains of aging fruit flies and wondered if it contributed to brain aging and overall loss of organismal health.

Their first clue of a correlation: Flies on a restricted diet both lived longer and had less F-actin buildup in their brains. Their second clue: When treated with a drug known to extend lifespan, called rapamycin, there was also less F-actin in the brains of aged flies.

Investigating Causality through Genetic Modification

“But that’s correlation, not a direct demonstration that F-actin is detrimental to aging of the brain,” said Walker, senior author and UCLA professor of integrative biology and physiology. “To get at causality, we turned to genetics.”

Because the fruit fly genome is thoroughly mapped and understood, the group was able to target in aging fruit fly genes that are known to play important roles in the accumulation of actin filaments. That included a gene called Fhos, a member of a family of proteins known to elongate and organize actin filaments.

“When we reduced Fhos expression in aging neurons, it prevented the accumulation of F-actin in the brain,” said Schmid, now an investigator at the Arkansas Biosciences Institute and assistant professor at Arkansas State University. “This really allowed us to expand our study because now, we had a direct way to target F-actin accumulation in the brain and study how it affects the aging process.”

Even though the genetic intervention was targeted to just neurons, it improved the flies’ overall health. They lived 25-30% longer, while showing signs of improved brain function as well as markers of improved health in other organ systems. Preventing F-actin accumulation protects cognitive function, which shows the buildup is driving age-onset cognitive decline.

“Flies get more forgetful as they age, and their ability to learn and remember declines in middle age, just like it does in people,” Walker said. “If we prevent accumulation of F-actin, it helps the flies learn and remember when older — which tells us the buildup is not benign.”

F-Actin’s Interference with Cellular Autophagy

Further investigation showed the F-actin was interfering with the body’s “cellular garbage disposal system.” Damaged or superfluous proteins and other components inside a cell are broken down in a process called “autophagy.” Aging research has established that autophagy pathways become less active with age, but no one knew exactly why.

The new study shows that preventing F-actin accumulation led to much more active autophagy in the brains of aged fruit flies. The authors found that if they removed F-actin but also disabled autophagy, it did not slow aging: The primary mechanism by which F-actin drives brain aging appears to be by impairing autophagy. The researchers also showed that disrupting F-actin in aged brains can restore brain autophagy to youthful levels and reverse certain cellular markers of brain aging.

These findings may be good news for the elderly fruit flies with reduced F-actin in their brains. But it has not yet been demonstrated in humans, and developing interventions to prevent F-actin accumulation might prove more challenging. Still, the discovery directs researchers in a fruitful new direction for healthier aging in people.

“Most of us in the aging field are focused on moving beyond lifespan into what we call the healthspan,” said Walker. “We want to help people enjoy good health and a high quality of life while extending the lifespan. Our study improved cognitive and gut function, activity level, and overall healthspan of fruit flies — and offers hope for what we might be able to achieve in humans.”

Reference: “Accumulation of F-actin drives brain aging and limits healthspan in Drosophila” by Edward T. Schmid, Joseph M. Schinaman, Naomi Liu-Abramowicz, Kylie S. Williams and David W. Walker, 25 October 2024, Nature Communications.

DOI: 10.1038/s41467-024-53389-w

The research was funded by the National Institutes of Health’s National Institute on Aging.",830,"lifespan, extends, factin, autophagy, brain, waste, flies, buildup, treatment, brains, promising, accumulation, blocking, aging, fruit",2024-10-30
27,poultry dairy according cattle department county bird flu utah food,"Estimated read time: 2-3 minutes

LOGAN — Eight commercial dairy operations in Cache County have tested positive for bird flu, according to officials with the Utah Department of Agriculture and Food.

The announcement comes a week after mandatory testing was put into place for all dairies in the county, where officials began taking weekly tank samples. ""Initial samples from all Cache County dairies were sent to the Utah Veterinary Diagnostic Laboratory in Logan,"" a press release sent out Wednesday says.

The eight positive dairies have been placed under quarantine, meaning no cattle are permitted to move on or off the facility grounds — except if going directly to slaughter, according to the release.

The bird flu was first detected in March at a Texas dairy, though it had been ""circulating in poultry and wild birds in the United States since 2022,"" according to the ag department website. The disease has spread to 14 states since, according to Caroline Hargraves, a spokeswoman for the Utah Department of Agriculture and Food.

A commercial poultry flock in Cache County tested positive for avian bird flu earlier this month, forcing the culling of an estimated 1,852,900 chickens, according to the Utah Department of Agriculture and Food's poultry flock outbreak online dashboard.

Data on cattle herd detections have not been updated on the website.

State veterinarian Daniel Christensen said they ""don't anticipate any major impacts on the food supply and the overall impacts to individual dairies are relatively minimal. This disease is not as harmful to dairy cattle as it is to poultry.""

The bird flu, which is fatal to poultry, is ""often transmitted by wild birds to domestic poultry,"" according to Hargraves.

The department is encouraging dairy and poultry owners to watch herds and flocks for signs of the disease, which include decreased milk production, thicker milk, decreased consumption, dehydration and fever in dairy cattle. ""Most dairy cattle recover within a few weeks,"" he said. Not all dairy cattle will show symptoms, however.

In poultry, symptoms include ""high death loss among flocks, nasal discharge, decreased appetite or water consumption and lack of coordination,"" Hargraves says.

Resources to help prevent the spread and obtain financial assistance for testing and prevention can be found online, at www.ag.utah.gov/dairy-cattle-and-avian-influenza.",371,"bird, according, herds, poultry, dairies, utah, dairy, flu, department, cattle, county, cache",Unknown
28,symptoms asked children school parents whooping cough high oak hills,"Oak Hills parents asked to monitor children after HS student diagnosed with whooping cough

Parents of Oak Hills High School students are being asked to monitor their children for symptoms after a student was diagnosed with whooping cough.Officials said the student attends Oak Hills High School.In a letter on Wednesday, the district asked parents of high school students to monitor their children for symptoms and keep them home from school if they are sick to mitigate the potential spread of the illness.Parents are asked to observe their children for symptoms through Nov. 16.Whooping cough is a highly contagious illness, with symptoms including a runny and congested nose, mild coughing and labored breathing.Symptoms typically start out mild but after one to two weeks, coughs can become more violent and affect a person's ability to breathe well.People who are diagnosed with whooping cough, also known as Pertussis, are infectious for five days after beginning antibiotics.

Parents of Oak Hills High School students are being asked to monitor their children for symptoms after a student was diagnosed with whooping cough.

Officials said the student attends Oak Hills High School.

Advertisement

In a letter on Wednesday, the district asked parents of high school students to monitor their children for symptoms and keep them home from school if they are sick to mitigate the potential spread of the illness.

Parents are asked to observe their children for symptoms through Nov. 16.

Whooping cough is a highly contagious illness, with symptoms including a runny and congested nose, mild coughing and labored breathing.

Symptoms typically start out mild but after one to two weeks, coughs can become more violent and affect a person's ability to breathe well.

People who are diagnosed with whooping cough, also known as Pertussis, are infectious for five days after beginning antibiotics.",299,"diagnosed, children, school, asked, oak, whooping, cough, student, hs, hills, symptoms, parents, monitor, high",2024-10-31
